,source,author,title,description,url,urlToImage,publishedAt,content
59,"{'id': 'business-insider', 'name': 'Business Insider'}",Katie Canales,"The FTC and state attorneys general are reportedly aiming up to 4 new antitrust lawsuits at Facebook and Google as talk of regulation continues to heat up (FB, GOOG)","Summary List PlacementFederal and state officials are gearing up to slap Facebook and Google with up to four new antitrust lawsuits by the end of January 2021, according to a Monday report from The Wall Street Journal.
The lawsuits are intended to determine i…",https://www.businessinsider.com/facebook-google-new-antitrust-lawsuits-expected-by-end-january-report-2020-11,https://i.insider.com/5f6ccc88c4049200115cb6ff?width=1200&format=jpeg,2020-11-30T16:58:37Z,"Federal and state officials are gearing up to slap Facebook and Google with up to four new antitrust lawsuits by the end of January 2021, according to a Monday report from The Wall Street Journal.
T… [+3551 chars]"
60,"{'id': 'business-insider', 'name': 'Business Insider'}",Tyler Sonnemaker,"Nike, Coca-Cola, and Apple reportedly lobbied to weaken a bill aimed at preventing them from manufacturing products in China using forced Uighur labor (AAPL, NIKE, KO)","Summary List PlacementNike, Coca-Cola, and Apple all sought to weaken proposed legislation aimed at barring US companies from relying on the forced labor of Uighurs and other Muslim minorities in China's Xinjiang region, The New York Times reported Sunday.
Th…",https://www.businessinsider.com/apple-nike-coca-cola-lobbied-china-uyghur-forced-labor-bill-2020-11,https://i.insider.com/5fc5c00750e71a00115581b2?width=1200&format=jpeg,2020-12-01T06:41:03Z,"Nike, Coca-Cola, and Apple all sought to weaken proposed legislation aimed at barring US companies from relying on the forced labor of Uighurs and other Muslim minorities in China's Xinjiang region, … [+4398 chars]"
61,"{'id': 'business-insider', 'name': 'Business Insider'}",Lauren Johnson,The 18 hottest adtech companies of 2020,"Summary List PlacementThe coronavirus hit the adtech industry hard in 2020.
Advertisers cut ad spend in March, which meant less money for the digital ad firms that live off ad spend. Adtech companies also continued to fight for scraps from the triopoly of Goo…",https://www.businessinsider.com/the-18-hottest-adtech-companies-of-2020-2020-11,https://i.insider.com/5fc7cee550e71a00115586f6?width=1200&format=jpeg,2020-12-03T17:49:48Z,"The coronavirus hit the adtech industry hard in 2020.
Advertisers cut ad spend in March, which meant less money for the digital ad firms that live off ad spend. Adtech companies also continued to fi… [+1576 chars]"
62,"{'id': 'business-insider', 'name': 'Business Insider'}",Mark Matousek,The CEO of Aeva left a comfortable job at Apple to start a lidar company. Here's how he knew it was time to become his own boss.,"Summary List PlacementAfter selling his second startup in 2012, Soroush Salehian landed at Apple, a destination job for many in the tech industry.
But after four years in the tech giant's special-projects group, Salehian felt it was time for a new challenge. …",https://www.businessinsider.com/aeva-apple-lidar-soroush-salehian-2020-11,https://i.insider.com/5fc54e63037cbd0018612f1f?width=1200&format=jpeg,2020-12-02T13:43:00Z,"After selling his second startup in 2012, Soroush Salehian landed at Apple, a destination job for many in the tech industry.
But after four years in the tech giant's special-projects group, Salehian… [+4545 chars]"
63,"{'id': 'business-insider', 'name': 'Business Insider'}",Antonio Villas-Boas,The best Cyber Monday 2020 smartphone deals include up to 30% off Samsung's coveted Galaxy S20 phones,"Summary List Placement

<ul>
<li>Cyber Monday 2020 is a great time to get deals on smartphones and other major tech devices.</li>
<li>This year, discounts are especially great on Samsung's coveted Galaxy S20 phones, Motorola's Moto G series, and Google's Pixe…",https://www.businessinsider.com/best-cyber-monday-2020-smartphone-deals-galaxy-s20-2020-11,https://i.insider.com/5fc3f6e3037cbd0018612c5e?width=1200&format=jpeg,2020-11-30T13:28:27Z,"When you buy through our links, we may earn money from our affiliate partners. Learn more.
Smartphones are getting the Cyber Monday 2020 deal treatment right now, with especially excellent deals on … [+2146 chars]"
64,"{'id': 'business-insider', 'name': 'Business Insider'}",Shona Ghosh,10 things in tech you need to know today,"Summary List PlacementGood morning! This is the tech news you need to know this Wednesday. Sign up here to get this email in your inbox every morning.
Have an Amazon Alexa device? Listen to this update by searching ""Business Insider"" in your flash briefing se…",https://www.businessinsider.com/10-things-in-tech-you-need-to-know-today-december-23-2020-12,https://i.insider.com/5eea170af0f4197422718a72?width=1200&format=jpeg,2020-12-23T08:03:05Z,"Good morning! This is the tech news you need to know this Wednesday. Sign up here to get this email in your inbox every morning.
Have an Amazon Alexa device? Listen to this update by searching ""Busi… [+2530 chars]"
65,"{'id': 'business-insider', 'name': 'Business Insider'}",Martine Paris,How sleep-tracking ring Oura went from a Kickstarter campaign to becoming Silicon Valley and the NBA bubble's favorite gadget,"Summary List PlacementOn November 4, Oura lit up Times Square with its towering billboard announcing how much sleep Americans lost on Election Night (138 million hours total, or 25.2 minutes per person, according to company data). It was a sign that the sleep…",https://www.businessinsider.com/oura-ring-kickstarter-silicon-valley-nba-bubble-2020-12,https://i.insider.com/5fda40226524f10019792629?width=1200&format=jpeg,2020-12-16T18:16:23Z,"On November 4, Oura lit up Times Square with its towering billboard announcing how much sleep Americans lost on Election Night (138 million hours total, or 25.2 minutes per person, according to compa… [+10624 chars]"
66,"{'id': 'business-insider', 'name': 'Business Insider'}",Ronda Lee,The best cheap car insurance in Minnesota,"Summary List PlacementTable of Contents: Masthead StickyCar insurance is fairly affordable for Minnesota drivers. The average driver pays $840, less than the US national average, according to the Insurance Information Institute. But, that's not to say that th…",https://www.businessinsider.com/personal-finance/best-cheap-car-insurance-minnesota,https://i.insider.com/5fd7a7bf9cf1420018d2f362?width=1200&format=jpeg,2020-12-14T20:54:27Z,"Personal Finance Insider writes about products, strategies, and tips to help you make smart decisions with your money. We may receive a small commission from our partners, like American Express, but … [+8280 chars]"
67,"{'id': 'business-insider', 'name': 'Business Insider'}",Samantha Stokes and Jack Newsham,5 top capital-markets lawyers take us inside the IPO frenzy: Here's how they're raking in millions on the hottest public debuts of the year — and what they think 2021 will look like,"Summary List PlacementA late-year boom in initial public offerings has meant a burst of activity for already-busy capital markets lawyers at prominent law firms like Cooley, Latham & Watkins, and Simpson Thacher & Bartlett.
After a dropoff due to the coronavi…",https://www.businessinsider.com/lawyers-ipo-doordash-capital-markets-cooley-latham-simpson-davis-polk-2020-12,https://i.insider.com/5fd7cb6d2069f400194c7a67?width=1200&format=jpeg,2020-12-14T20:56:35Z,"A late-year boom in initial public offerings has meant a burst of activity for already-busy capital markets lawyers at prominent law firms like Cooley, Latham &amp; Watkins, and Simpson Thacher &amp;… [+10726 chars]"
68,"{'id': 'business-insider', 'name': 'Business Insider'}",Yoonji Han,Meet the litigator duo at the elite law firm Kirkland & Ellis that has racked up nearly $2 billion in verdicts and settlements in the last 18 months taking on high-stakes trade secret cases for firms like Motorola,"Summary List PlacementIn late October, Michael De Vries stood behind a plexiglass wall, a HEPA air filter silently at work above him, and addressed seven jury members, who sat several seats apart. They all wore masks, as did De Vries.
It was one of the first …",https://www.businessinsider.com/kirkland-ellis-devries-alper-intellectual-property-litigation-law-2020-12,https://i.insider.com/5fe0bac9c910a400192e8abf?width=1200&format=jpeg,2020-12-21T21:28:35Z,"In late October, Michael De Vries stood behind a plexiglass wall, a HEPA air filter silently at work above him, and addressed seven jury members, who sat several seats apart. They all wore masks, as … [+9527 chars]"
69,"{'id': 'business-insider', 'name': 'Business Insider'}",Maddy Simpson,"Discovery just announced the launch of its own streaming service, joining other streaming giants Disney, Netflix, and Hulu. Here's how the media giant pays its executives.","Summary List PlacementOn January 4, 2021, Discovery will join Netflix, Disney, and Hulu in the streaming universe with its streaming platform, Discovery+. The service will be available to customers at $4.99 a month with ads or $6.99 for ad-free viewing. 
The …",https://www.businessinsider.com/how-media-giant-discovery-paid-its-executives-in-2019-2020-12,https://i.insider.com/5fc8fc3e037cbd001861390c?width=1200&format=jpeg,2020-12-03T18:48:38Z,"On January 4, 2021, Discovery will join Netflix, Disney, and Hulu in the streaming universe with its streaming platform, Discovery+. The service will be available to customers at $4.99 a month with a… [+3100 chars]"
70,"{'id': 'business-insider', 'name': 'Business Insider'}",Ben Gilbert,"'Cyberpunk 2077' sales have already topped 13 million despite the game being pulled from the PlayStation 4 (GME, SNE, MSFT, OTGLY)","Summary List PlacementDespite a messy launch which resulted in the game being outright pulled from the PlayStation online store, ""Cyberpunk 2077"" has already moved over 13 million copies.
The Polish game studio behind this year's most anticipated game announc…",https://www.businessinsider.com/cyberpunk-2077-sales-top-13-million-2020-12,https://i.insider.com/5fdc812bc910a400192e83fc?width=1200&format=jpeg,2020-12-22T20:31:13Z,"Despite a messy launch which resulted in the game being outright pulled from the PlayStation online store, ""Cyberpunk 2077"" has already moved over 13 million copies.
The Polish game studio behind th… [+2557 chars]"
71,"{'id': 'business-insider', 'name': 'Business Insider'}",Connie Chen and Julia Pugachevsky,"The 23 best early Cyber Monday deals so far include 50% off a robot vacuum, an Echo Dot for under $30, and 56% off an Xbox membership","Summary List Placement<ul>
<li>
Black Friday 2020 is officially over, but you can still snag great deals this Sunday in the lead-up to Cyber Monday. </li>
<li>If you missed out on any Black Friday deals, we found 25 tech, home, kitchen, and style sales that a…",https://www.businessinsider.com/best-cyber-monday-2020-deals-available-on-sunday-2020-11,https://i.insider.com/5fc2548a50e71a0011557cd5?width=1200&format=jpeg,2020-11-29T15:49:34Z,"When you buy through our links, we may earn money from our affiliate partners. Learn more.
Black Friday is a busy day for everyone, especially when you have to divide your time between making the pe… [+784 chars]"
72,"{'id': 'business-insider', 'name': 'Business Insider'}",Madison Hoff,"The 25 large companies with the best CEOs in 2020, according to employees","Summary List PlacementOne career site found the most highly ranked CEOs based on employee ratings during this difficult year.
Career website Comparably just released its fourth annual ranking of companies with the best CEOs. To do this, Comparably anonymously…",https://www.businessinsider.com/large-companies-best-ceos-comparably-2020-12,https://i.insider.com/5fd7af989cf1420018d2f3cc?width=1200&format=jpeg,2020-12-15T14:00:43Z,"One career site found the most highly ranked CEOs based on employee ratings during this difficult year.
Career website Comparably just released its fourth annual ranking of companies with the best C… [+1003 chars]"
73,"{'id': 'business-insider', 'name': 'Business Insider'}",Grace Dean and Zac Ntim,"'Tenet' director Christopher Nolan blasts Warner Bros. decision to debut movies on HBO Max, 'the worst streaming service'","Summary List PlacementChristopher Nolan has slammed Warner Bros.' decision to release all its 2021 movies simultaneously in theaters and on HBO Max, which he dubbed ""the worst streaming service.""
The move, announced Thursday, made ""no economic sense"" and was …",https://www.businessinsider.com/christopher-nolan-warner-bros-hbo-max-worst-streaming-service-tenet-2020-12,https://i.insider.com/5fcf5407037cbd00186146d6?width=1200&format=jpeg,2020-12-08T10:45:52Z,"Christopher Nolan has slammed Warner Bros.' decision to release all its 2021 movies simultaneously in theaters and on HBO Max, which he dubbed ""the worst streaming service.""
The move, announced Thur… [+3414 chars]"
74,"{'id': 'business-insider', 'name': 'Business Insider'}",William Edwards,BlackRock is channeling more cash to high-momentum and relatively small stocks as the economy recovers. These are the 20 companies they're earmarking the most money for.,"Summary List PlacementIt's no secret by now that cyclical stocks are poised for outperformance with an economic recovery on the way.
It's not the best outlook for growth stocks, on the other hand, which face threats like overextended valuations and increasing…",https://www.businessinsider.com/stock-picks-18-companies-factor-etfs-blackrock-overweight-momentum-size-2020-12,https://i.insider.com/5fc6af7650e71a00115584ad?width=1200&format=jpeg,2020-12-02T13:15:00Z,"It's no secret by now that cyclical stocks are poised for outperformance with an economic recovery on the way.
It's not the best outlook for growth stocks, on the other hand, which face threats like… [+1656 chars]"
75,"{'id': 'business-insider', 'name': 'Business Insider'}",Dave Johnson,What is Android TV? Here's what you need to know about Google's smart TV system,"Summary List PlacementNo matter which smart TV you purchase, it comes equipped with some operating system that gives you access to your streaming video channels and content subscriptions. 
Common operating systems include Roku and Tizen, but an increasingly p…",https://www.businessinsider.com/what-is-android-tv,https://i.insider.com/5fcac623b6a3a800199b6d69?width=1200&format=jpeg,2020-12-11T22:28:19Z,"No matter which smart TV you purchase, it comes equipped with some operating system that gives you access to your streaming video channels and content subscriptions. 
Common operating systems includ… [+2875 chars]"
76,"{'id': 'business-insider', 'name': 'Business Insider'}",Dave Johnson,What is Acorn TV? Everything you need to know about the streaming service that offers international shows,"Summary List PlacementAcorn TV is a streaming video subscription service that specializes in television programs from the UK, Ireland, Canada, Australia, and a handful of other countries.  
What Acorn TV offers
Acorn TV offers a broad range of content from th…",https://www.businessinsider.com/what-is-acorn-tv,https://i.insider.com/5fd7dbfe78a5740019a155cf?width=1200&format=jpeg,2020-12-16T20:42:11Z,"Acorn TV is a streaming video subscription service that specializes in television programs from the UK, Ireland, Canada, Australia, and a handful of other countries.  
What Acorn TV offers
Acorn TV… [+1856 chars]"
77,"{'id': 'business-insider', 'name': 'Business Insider'}",Steven Cohen,"Vizio's 65-inch 4K OLED TV has unbeatable picture quality for $1,800, but HDMI issues and glitches could turn off some people","Summary List Placement<ul>
<li>Vizio's first 4K OLED TV is a stunning display with truly high-end image quality for a very competitive price.</li>
<li>Sadly, however, that impressive picture is sometimes dashed by glitches and HDMI signal issues. </li>
<li>Bu…",https://www.businessinsider.com/vizio-4k-oled-tv-oled65-h1-review,https://i.insider.com/5fd396d0e00bce00188baccc?width=1200&format=jpeg,2020-12-11T16:24:25Z,"When you buy through our links, we may earn money from our affiliate partners. Learn more.
When it comes to picture performance, no consumer display technology currently beats OLED. That acronym sta… [+17525 chars]"
78,"{'id': 'business-insider', 'name': 'Business Insider'}",Dave Johnson,"How Low Data Mode works on an iPhone, and how you can use it to save cellular data or Wi-Fi bandwidth","Summary List PlacementIf you need to reduce the amount of internet data you're using on your iPhone, check out Low Data Mode.
 Low Data Mode was introduced in iOS 13, and can help conserve data on both Wi-Fi and cellular — convenient if you have low bandwidth…",https://www.businessinsider.com/low-data-mode-iphone,https://i.insider.com/5fdba2a4d366e60018098b38?width=1200&format=jpeg,2020-12-17T19:17:51Z,"If you need to reduce the amount of internet data you're using on your iPhone, check out Low Data Mode.
What version of iOS do I have? How to find which version your iPhone is running and check if t… [+2619 chars]"
79,"{'id': 'business-insider', 'name': 'Business Insider'}",Jason Aten,I used a Microsoft Surface Duo and Samsung Z Fold2 to see if foldable phones are really worth the hype,"Summary List PlacementIf the smartphone is the device where you spend the greatest amount of time, it has to be good. It has to be capable of handling any of the tasks you might throw at it without slowing you down. You can imagine, then, why so many companie…",https://www.businessinsider.com/microsoft-surface-duo-samsung-z-foldable-phone-devices-review-hype-2020-12,https://i.insider.com/5fdaf828d366e600180988fd?width=1200&format=jpeg,2020-12-17T17:12:34Z,"If the smartphone is the device where you spend the greatest amount of time, it has to be good. It has to be capable of handling any of the tasks you might throw at it without slowing you down. You c… [+6950 chars]"
80,"{'id': 'business-insider', 'name': 'Business Insider'}",Andrea Bossi,"20 of the best gifts for vegans in 2020, from cookbooks to cruelty-free beauty products","Summary List Placement

<ul>
<li>If you're looking for gifts for a vegan or plant-based dabbler, we've got you covered with some ideas across product type, price, and flavor. </li>
<li>Some of our favorite items include vegan chicken nuggets, a charitable soy…",https://www.businessinsider.com/best-gifts-for-vegans,https://i.insider.com/5fd7c87b2069f400194c7a3f?width=1200&format=jpeg,2020-12-14T22:04:10Z,"When you buy through our links, we may earn money from our affiliate partners. Learn more.
The vegan lifestyle is starting to noticeably influence culture, from Starbucks breakfast sandwiches to spe… [+968 chars]"
81,"{'id': 'business-insider', 'name': 'Business Insider'}",Rachael Schultz,"40 last-minute Cyber Monday deals you can still get tonight, including AirPods, TVs, weighted blankets, and toys for kids","Summary List Placement<ul>
<li>Big-ticket items are still in stock and running at major discounts, including Apple Airpods, which are down to $110, a Samsung Galaxy tablet at $150, and an Insignia 32-inch smart TV for only $100.</li>
<li>Items that are rarely…",https://www.businessinsider.com/last-minute-cyber-monday-deals-still-available-now-2020-11,https://i.insider.com/5fc5aab850e71a00115581ac?width=1200&format=jpeg,2020-12-01T02:30:23Z,"When you buy through our links, we may earn money from our affiliate partners. Learn more.
Cyber Monday 2020 and the four days of deals from 
 Black Friday weekend are all winding down. If you have… [+4081 chars]"
82,"{'id': 'business-insider', 'name': 'Business Insider'}",Candy Cheng and Bradley Saacks,IT'S NOT THAT HARD: Here are 21 female tech leaders ideal for board seats as Nasdaq forces corporate America's hand,"Summary List PlacementNasdaq — a rare major company with a female CEO — said on Tuesday that the 3,249 companies listed on its main U.S. exchange should have ""at least two diverse directors"" on their boards, or risk being delisted.
The proposal, currently bei…",https://www.businessinsider.com/top-female-tech-leaders-ideal-for-corporate-boards-2020-12,https://i.insider.com/5fc92cb4037cbd0018613a72?width=1200&format=jpeg,2020-12-03T20:41:58Z,"Nasdaq — a rare major company with a female CEO — said on Tuesday that the 3,249 companies listed on its main U.S. exchange should have ""at least two diverse directors"" on their boards, or risk being… [+2423 chars]"
83,"{'id': 'business-insider', 'name': 'Business Insider'}",Vicky Ge Huang,Goldman Sachs highlights the top 25 dividend issuers on the S&P 500 to buy as it expects their payouts to rebound next year and keep growing over the next decade,"Summary List PlacementAs many Wall Street strategists have called it, November was truly a month to remember.
Thanks to positive vaccine news, the S&P 500 rose nearly 11% to deliver some of its best gains in the past 30 years while out-of-favor value stocks s…",https://www.businessinsider.com/stocks-to-buy-2021-top-dividend-payers-sp500-goldman-sachs-2020-12,https://i.insider.com/5f7c7e9294fce90018f7b4c2?width=1200&format=jpeg,2020-12-08T13:05:00Z,"As many Wall Street strategists have called it, November was truly a month to remember.
Thanks to positive vaccine news, the S&amp;P 500 rose nearly 11% to deliver some of its best gains in the past… [+2602 chars]"
84,"{'id': 'business-insider', 'name': 'Business Insider'}",Tyler Sonnemaker,Facebook reportedly told its ad reviewers to ignore fraud and hacked accounts as long as 'Facebook gets paid' (FB),Summary List PlacementA blistering investigation into Facebook's ad business published by BuzzFeed News on Thursday revealed in new detail how the company prioritizes making money over enforcing its own rules intended to protect users from scammers and hacker…,https://www.businessinsider.com/facebook-allowed-fraud-hacked-accounts-ads-got-paid-2020-12,https://i.insider.com/5f69dc2a57b7da001ee12fd8?width=1200&format=jpeg,2020-12-11T07:15:22Z,A blistering investigation into Facebook's ad business published by BuzzFeed News on Thursday revealed in new detail how the company prioritizes making money over enforcing its own rules intended to … [+3993 chars]
85,"{'id': 'business-insider', 'name': 'Business Insider'}",Ryan Ariano,What is Philo TV? Here's everything you need to know about the low-cost TV streaming service,"Summary List PlacementCord-cutters have been canceling their cable TV services in increasing numbers due to the ease of online streaming. While services like Netflix, Disney+, Hulu, and Amazon Prime Video have received the most attention, there are also many …",https://www.businessinsider.com/what-is-philo-tv,https://i.insider.com/5f34229c4dca6876bf783fb7?width=1200&format=jpeg,2020-12-18T21:26:17Z,"Cord-cutters have been canceling their cable TV services in increasing numbers due to the ease of online streaming. While services like Netflix, Disney+, Hulu, and Amazon Prime Video have received th… [+2916 chars]"
86,"{'id': 'business-insider', 'name': 'Business Insider'}",tbufete@businessinsider.com (Tercius Bufete),"Today's best online deals: Apple Watch SE, Google Home Max speaker, and Braun Series 7 razor","We rounded up the best deals happening on December 15, 2020. Save big on Apple Watch SE, Google Home Max speaker, Wemo plug, and Braun Series 7 razor.",https://www.businessinsider.com/best-online-deals-today-tuesday-december-15-2020,https://i.insider.com/5fd8ba3e78a5740019a15757?width=1200&format=jpeg,2020-12-15T15:31:55Z,"When you buy through our links, we may earn money from our affiliate partners. Learn more.
Every day, we round up the 20 best deals and bargains available on tech, home goods, fashion, and more. 
W… [+289 chars]"
87,"{'id': 'business-insider', 'name': 'Business Insider'}",Lisa Eadicicco,"Amazon's smart glasses that can beam Alexa straight to your ears feel like the future, but with some major downsides","Summary List Placement<ul>
<li>
Amazon's Echo Frames prove that smart glasses can be more than a gimmick by providing useful, hands-free notifications and music playback.</li>
<li>You can do many of the same things on the Echo Frames as you can with other Ale…",https://www.businessinsider.com/amazon-echo-frames-review,https://i.insider.com/5fe23ba4c910a400192e9082?width=1200&format=jpeg,2020-12-23T14:42:12Z,"When you buy through our links, we may earn money from our affiliate partners. Learn more.
From light bulbs to door locks, TVs, thermostats, security cameras, and even toothbrushes, Amazon's Alexa a… [+15349 chars]"
88,"{'id': 'business-insider', 'name': 'Business Insider'}",Lydia Ramsey Pflanzer,We're on the cusp of vaccine authorizations,"Summary List PlacementWelcome to Business Insider's daily healthcare newsletter, your daily dose of pharma, biotech, and healthcare news. Subscribe here to get this newsletter in your inbox every weekday.


Hello,
Somehow, dear readers, we've made it to Decem…",https://www.businessinsider.com/business-insiders-biggest-healthcare-stories-week-ending-december-4-2020-12,https://i.insider.com/5fc8d4f8037cbd00186138a1?width=1200&format=jpeg,2020-12-04T16:55:42Z,"Welcome to Business Insider's daily healthcare newsletter, your daily dose of pharma, biotech, and healthcare news. Subscribe here to get this newsletter in your inbox every weekday.
Hollis Johnson/… [+5766 chars]"
