,source,author,title,description,url,urlToImage,publishedAt,content
12,"{'id': 'info-money', 'name': 'InfoMoney'}",Redação,"Fernando Assad, da Ashmore: como um especialista em mercados emergentes está investindo agora","O responsável pelo mandato de ações de mercados emergentes da gestora britânica é o entrevistado do 17º episódio do podcast Outliers
The post Fernando Assad, da Ashmore: como um especialista em mercados emergentes está investindo agora appeared first on InfoM…",https://www.infomoney.com.br/onde-investir/fernando-assad-da-ashmore-como-um-especialista-em-mercados-emergentes-esta-investindo-agora/,https://www.infomoney.com.br/wp-content/uploads/2019/06/emergentes-asia.jpg?fit=900%2C601&quality=75&strip=all,2020-12-06T11:00:04Z,"SÃO PAULO – Entender a dinâmica das economias emergentes foi o que levou o economista Fernando Assad para o mercado financeiro, logo após concluir a graduação, em Londres, no final dos anos 1990. Ess… [+3423 chars]"
13,"{'id': 'info-money', 'name': 'InfoMoney'}",Gabriel Garcia,Gestão do caixa nas empresas: duas dicas para o ano que chega,"Empresas devem olhar com cautela na gestão de seu caixa em 2021. Além disso, cenário de juros baixos persiste e implica na maior especialização de tesourarias na gestão do risco e retorno
The post Gestão do caixa nas empresas: duas dicas para o ano que chega …",https://www.infomoney.com.br/colunistas/rodrigo-moreira/gestao-do-caixa-nas-empresas-duas-dicas-para-o-ano-que-chega/,https://www.infomoney.com.br/wp-content/uploads/2019/06/cofre-e-moeda.png?fit=900%2C471&quality=75&strip=all,2020-12-14T17:00:58Z,"Em primeiro lugar, um breve diagnóstico do ano que se aproxima é, no mínimo, preocupante.
Apesar do otimismo natural sempre que se começa um novo ciclo, turbinado principalmente por boas notícias re… [+3771 chars]"
14,"{'id': 'info-money', 'name': 'InfoMoney'}",Agência Estado,Google fica fora do ar por 45 minutos e expõe dependência de seus serviços,"Para especialistas, a falha de ontem, na verdade, sinaliza como estamos cada vez mais dependentes de poucas empresas
The post Google fica fora do ar por 45 minutos e expõe dependência de seus serviços appeared first on InfoMoney.",https://www.infomoney.com.br/negocios/google-fica-fora-do-ar-por-45-minutos-e-expoe-dependencia-de-seus-servicos/,https://www.infomoney.com.br/wp-content/uploads/2019/10/shutterstock_190643744-1.jpg?fit=5760%2C3840&quality=75&strip=all,2020-12-15T11:15:00Z,"(Shutterstock) 
Estudante do segundo ano do ensino médio, Anna Júlia de Lima Cabral tinha um compromisso decisivo às 9 da manhã de ontem: encarar uma prova online de História.
Em recuperação, ela p… [+3536 chars]"
15,"{'id': 'info-money', 'name': 'InfoMoney'}",Anderson Figo,Naji Nahas: o especulador que quebrou a bolsa do Rio,"Ex-diretor da antiga BM&F Bovespa e ex-agente autônomo da época contam a saga do empresário libanês criado no Egito que virou folclore no mercado brasileiro
The post Naji Nahas: o especulador que quebrou a bolsa do Rio appeared first on InfoMoney.",https://www.infomoney.com.br/mercados/naji-nahas-o-especulador-que-quebrou-a-bolsa-do-rio/,https://www.infomoney.com.br/wp-content/uploads/2020/09/OS-PREGOES-QUE-FIZERAM-HISTORIA.jpg?fit=1280%2C853&quality=75&strip=all,2020-12-05T11:30:24Z,"SÃO PAULO No dia 9 de junho de 1989, a bolsa de valores de São Paulo, a Bovespa (hoje B3), despencou 5,6%. Já a bolsa de valores do Rio de Janeiro, a BVRJ, caiu 4,5% naquele dia. As quedas acontecera… [+3716 chars]"
16,"{'id': 'info-money', 'name': 'InfoMoney'}",Gabriel Garcia,"Investindo no exterior, de corpo e alma","Nosso mercado já conta com instrumentos e players prontos para oferecer soluções adequadas para que cada investidor possa se beneficiar de uma verdadeira e eficaz diversificação de riscos em seus investimentos
The post Investindo no exterior, de corpo e alma …",https://www.infomoney.com.br/colunistas/convidados/investindo-no-exterior-de-corpo-e-alma/,https://www.infomoney.com.br/wp-content/uploads/2020/10/GettyImages-1227021821.jpg?fit=2309%2C1299&quality=75&strip=all,2020-12-08T14:00:25Z,"*Com a colaboração de Rodrigo Lobo, co-fundador da gestora Investidor Profissional. Hoje, é sócio e diretor da Nextep Investimentos. É economista com MBA pela Wharton School, da Universidade da Pensi… [+4874 chars]"
17,"{'id': 'info-money', 'name': 'InfoMoney'}",fernandoprandi,Grupo Kallas teve um dos melhores anos apesar da pandemia,"Construtora reorganizou estrutura para enfrentar cenário desafiador e pretende lançar R$ 2 bilhões em 2021 
The post Grupo Kallas teve um dos melhores anos apesar da pandemia appeared first on InfoMoney.",https://www.infomoney.com.br/negocios/grupo-kallas-teve-um-dos-melhores-anos-apesar-da-pandemia/,https://www.infomoney.com.br/wp-content/uploads/2020/10/GettyImages-970782162.jpg?fit=2121%2C1414&quality=75&strip=all,2020-12-15T11:11:34Z,"O convidado de mais uma edição do Construcast, o 29º episódio da temporada 2020, é o doutor Emílio Kallas, como é conhecido o fundador do Grupo Kallas. A empresa nasceu em 1983 e é conhecida por entr… [+4175 chars]"
18,"{'id': 'info-money', 'name': 'InfoMoney'}",Redação,"Não posso cortar investimentos só porque estou com medo: como investe Leda Braga, referência no mercado mundial de fundos quantitativos","CEO da Systematica Investments, que tem R$ 50 bilhões sob gestão, é a entrevistada do 18º episódio do podcast Outliers
The post Não posso cortar investimentos só porque estou com medo: como investe Leda Braga, referência no mercado mundial de fundos quantitat…",https://www.infomoney.com.br/onde-investir/na-britanica-systematica-leda-braga-usa-algoritmos-para-reduzir-o-efeito-das-emocoes-nas-decisoes-de-investimento/,https://www.infomoney.com.br/wp-content/uploads/2019/06/leda-braga.jpg?fit=900%2C471&quality=75&strip=all,2020-12-20T12:10:41Z,"SÃO PAULO – A carioca Leda Braga mudou-se para Londres em 1988 para cursar um doutorado no Imperial College. Ela até ensaiou uma carreira acadêmica, mas, cinco anos depois, já estava trabalhando com … [+4668 chars]"
19,"{'id': 'info-money', 'name': 'InfoMoney'}",fernandoprandi,Da olaria ao maior prédio da América Latina: a trajetória da Pasqualotto,"Construtora dona de empreendimentos como o Yachthouse, em Balneário Camboriú, tem forte atuação no litoral de Santa Catarina e segue em ritmo de expansão
The post Da olaria ao maior prédio da América Latina: a trajetória da Pasqualotto appeared first on InfoM…",https://www.infomoney.com.br/negocios/da-olaria-ao-maior-predio-da-america-latina-a-trajetoria-da-pasqualotto/,https://www.infomoney.com.br/wp-content/uploads/2020/12/Pasqualotto-Neto.png?fit=480%2C394&quality=75&strip=all,2020-12-22T11:00:14Z,"O convidado do último episódio é Alcino Pasqualotto Neto, empresário com apenas 34 anos, e hoje presidente e sócio majoritário da construtora Pasqualotto. Com vocação empreendedora, ele iniciou seus … [+4034 chars]"
20,"{'id': 'info-money', 'name': 'InfoMoney'}",Gabriel Garcia,“O cinema é o novo vinil”: como decisão da Warner Bros. pode transformar o mercado do entretenimento,"Estúdio vai lançar seus principais filmes de 2021 ao mesmo tempo na telona e no streaming. O que isso significa para Hollywood?
The post “O cinema é o novo vinil”: como decisão da Warner Bros. pode transformar o mercado do entretenimento appeared first on Inf…",https://www.infomoney.com.br/negocios/o-cinema-e-o-novo-vinil-como-decisao-da-warner-bros-pode-transformar-o-mercado-do-entretenimento/,https://www.infomoney.com.br/wp-content/uploads/2020/12/dune_production-7.jpg?fit=675%2C450&quality=75&strip=all,2020-12-12T11:00:32Z,"“Não há absolutamente nenhum amor pelo cinema nem pelo público”, diz o diretor Denis Villeneuve, de Duna (foto) sobre a decisão da Warner 
NOVA YORK O mundo do cinema mal teve tempo de celebrar as b… [+7702 chars]"
21,"{'id': 'info-money', 'name': 'InfoMoney'}",Anderson Figo,Os movimentos do bilionário Luiz Barsi na pandemia de coronavírus e os bastidores da Bolsa por Finkelsztain,"Escalada da Covid-19 em março de 2020 parou o mundo e causou seis circuit breakers na B3; entenda o caminho do vírus e as reações dos investidores
The post Os movimentos do bilionário Luiz Barsi na pandemia de coronavírus e os bastidores da Bolsa por Finkelsz…",https://www.infomoney.com.br/mercados/os-movimentos-do-bilionario-luiz-barsi-na-pandemia-de-coronavirus-e-os-bastidores-da-bolsa-por-finkelsztain/,https://www.infomoney.com.br/wp-content/uploads/2020/09/OS-PREGOES-QUE-FIZERAM-HISTORIA.jpg?fit=1280%2C853&quality=75&strip=all,2020-12-19T11:30:44Z,"SÃO PAULO No dia 9 de março de 2020, o temor com o avanço do coronavírus e seu impacto nas economias globais, além da guerra do petróleo, derrubaram as bolsas pelo mundo. O Ibovespa teve um circuit b… [+6472 chars]"
22,"{'id': 'info-money', 'name': 'InfoMoney'}",Ricardo Bonfim,"Ibovespa retoma o nível pré-Carnaval e fecha semana com alta de 2,9%; dólar cai a R$ 5,12","Mercado termina mais uma sessão no positivo em uma sessão marcada pela valorização das commodities
The post Ibovespa retoma o nível pré-Carnaval e fecha semana com alta de 2,9%; dólar cai a R$ 5,12 appeared first on InfoMoney.",https://www.infomoney.com.br/mercados/ibovespa-retoma-o-nivel-pre-carnaval-e-fecha-semana-com-alta-de-29-dolar-cai-a-r-512/,https://www.infomoney.com.br/wp-content/uploads/2019/06/alta-acoes-1.jpg?fit=900%2C900&quality=75&strip=all,2020-12-04T21:28:59Z,"Painel de ações (Shutterstock) 
SÃO PAULO – O Ibovespa fechou em alta de 1,3% a 113.750 pontos nesta sexta-feira (4), terminando essa semana marcada pelos cronogramas de vacinação contra a Covid-19 … [+15360 chars]"
23,"{'id': 'info-money', 'name': 'InfoMoney'}",Ricardo Bonfim,Ibovespa sobe quase 83% desde a mínima do ano e zera perdas em 2020: confira o que esperar daqui para frente,"2020 foi repleto de reviravoltas, passando desde o auge do temor com o coronavírus até a esperança com a vacina; expectativa é por maior alta para o índice 
The post Ibovespa sobe quase 83% desde a mínima do ano e zera perdas em 2020: confira o que esperar da…",https://www.infomoney.com.br/mercados/ibovespa-sobe-quase-83-desde-a-minima-do-ano-e-zera-perdas-em-2020-confira-o-que-esperar-daqui-para-frente/,https://www.infomoney.com.br/wp-content/uploads/2019/06/foguete-grafico-acoes-alta.jpg?fit=900%2C636&quality=75&strip=all,2020-12-15T22:41:41Z,"SÃO PAULO – O Ibovespa zerou as perdas de 2020 nesta terça-feira (15) ao fechar em alta de 1,34% a 116.148 pontos, e com isso a grande dúvida que paira entre os analistas é sobre o que ocorrerá com a… [+15139 chars]"
0,"{'id': 'bloomberg', 'name': 'Bloomberg'}",,"Apple Targets Autonomous Car for Consumers by 2024, Reuters Says - Bloomberg","<ol><li>Apple Targets Autonomous Car for Consumers by 2024, Reuters Says  Bloomberg
</li><li>Apple targets self-driving car production by 2024 with breakthrough battery technology, sources say  The Globe and Mail
</li><li>Apple shares rise on report of 2024…",https://www.bloomberg.com/tosv2.html?vid=&uuid=ad6bc940-4465-11eb-97c5-bfaf0a728cc5&url=L25ld3MvYXJ0aWNsZXMvMjAyMC0xMi0yMS9hcHBsZS10YXJnZXRzLWF1dG9ub21vdXMtY2FyLWZvci1jb25zdW1lcnMtYnktMjAyNC1yZXV0ZXJzLXNheXM/c3JuZD10ZWNobm9sb2d5LXZw,,2020-12-21T22:43:00Z,
1,"{'id': 'bloomberg', 'name': 'Bloomberg'}",,"Apple, Amazon, Google Could Face EU Fines as High as 10% Annual Revenue - Bloomberg","<ol><li>Apple, Amazon, Google Could Face EU Fines as High as 10% Annual Revenue  Bloomberg
</li><li>Big guns and Zoom cliques: Inside Silicon Valley’s digital lobbying playbook  POLITICO.eu
</li><li>EU to unveil landmark law curbing power of tech giants  DW…",https://www.bloomberg.com/tosv2.html?vid=&uuid=8434e160-3e61-11eb-a3fe-67b1aef195a5&url=L25ld3MvYXJ0aWNsZXMvMjAyMC0xMi0xNC90ZWNoLWdpYW50cy1jb3VsZC1mYWNlLWZpbmVzLWFzLWhpZ2gtYXMtMTAtYW5udWFsLXJldmVudWU=,,2020-12-14T13:26:00Z,
2,"{'id': 'bloomberg', 'name': 'Bloomberg'}",,How Convincing is Facebook's Case Against Apple?,,https://www.bloomberg.com/news/newsletters/2020-12-17/how-convincing-is-facebook-s-case-against-apple,,2020-12-17T11:45:19Z,
3,"{'id': 'bloomberg', 'name': 'Bloomberg'}",,The Big Apple Braces for Another Blow,,https://www.bloomberg.com/news/newsletters/2020-12-16/the-big-apple-braces-for-another-blow,,2020-12-16T12:30:21Z,
4,"{'id': 'bloomberg', 'name': 'Bloomberg'}",,Apple Starts Building Own Cellular Modem,,https://www.bloomberg.com/news/videos/2020-12-11/apple-starts-building-own-cellular-modem-video,,2020-12-11T23:32:03Z,
5,"{'id': 'bloomberg', 'name': 'Bloomberg'}",,Apple TV Is Missing the Moment,,https://www.bloomberg.com/news/newsletters/2020-12-22/apple-tv-is-missing-the-moment,,2020-12-22T11:45:20Z,
6,"{'id': 'bloomberg', 'name': 'Bloomberg'}",,Amazon Unveils Cloud Service to Power Apple App Development,,https://www.bloomberg.com/news/articles/2020-12-01/amazon-unveils-cloud-service-to-power-apple-app-development,,2020-12-01T05:10:07Z,
7,"{'id': 'bloomberg', 'name': 'Bloomberg'}",,Apple Inches Toward Record After Report on Autonomous Car Plans,,https://www.bloomberg.com/news/articles/2020-12-22/apple-inches-toward-record-after-report-on-autonomous-car-plans,,2020-12-22T16:08:19Z,
8,"{'id': 'bloomberg', 'name': 'Bloomberg'}",,Apple Should Partner With Tesla On EVs: Wedbush's Ives (Radio),,https://www.bloomberg.com/news/audio/2020-12-22/apple-should-partner-with-tesla-on-evs-wedbush-s-ives-radio,,2020-12-22T18:43:13Z,
9,"{'id': 'bloomberg', 'name': 'Bloomberg'}",,"Apple Targets Autonomous Car for Consumers by 2024, Reuters Says",,https://www.bloomberg.com/news/articles/2020-12-21/apple-targets-autonomous-car-for-consumers-by-2024-reuters-says,,2020-12-21T22:43:49Z,
10,"{'id': 'bloomberg', 'name': 'Bloomberg'}",,Musk Says Apple Refused to Discuss $60 Billion Tesla Deal,,https://www.bloomberg.com/news/articles/2020-12-22/musk-says-apple-refused-to-discuss-buying-tesla-for-60-billion,,2020-12-22T21:24:40Z,
11,"{'id': 'bloomberg', 'name': 'Bloomberg'}",,Apple Temporarily Shuts All California Stores as Covid Surges,,https://www.bloomberg.com/news/articles/2020-12-19/apple-temporarily-shuts-all-california-stores-as-covid-surges,,2020-12-19T20:44:23Z,
12,"{'id': 'bloomberg', 'name': 'Bloomberg'}",,Intel Shares Dip as Apple Plans Next Mac Chips,,https://www.bloomberg.com/news/videos/2020-12-07/intel-shares-dip-as-apple-plans-next-mac-chips-video,,2020-12-07T19:30:40Z,
13,"{'id': 'bloomberg', 'name': 'Bloomberg'}",,"Google, Amazon and Apple Face the Nuclear Option: Webb (Radio)",,https://www.bloomberg.com/news/audio/2020-12-16/google-amazon-and-apple-face-the-nuclear-option-webb-radio,,2020-12-16T18:38:45Z,
14,"{'id': 'bloomberg', 'name': 'Bloomberg'}",,Apple Should Partner With Tesla On EV: Wedbush's Ives (Podcast),,https://www.bloomberg.com/news/audio/2020-12-22/apple-should-partner-with-tesla-on-ev-wedbush-s-ives-podcast,,2020-12-22T19:15:29Z,
15,"{'id': 'bloomberg', 'name': 'Bloomberg'}",,"Apple, Oura Devices Can Help Detect Covid-19 Early, Studies Show",,https://www.bloomberg.com/news/newsletters/2020-12-14/apple-oura-devices-can-help-detect-covid-19-early-studies-show,,2020-12-14T11:45:20Z,
16,"{'id': 'bloomberg', 'name': 'Bloomberg'}",,"Apple Starts Work on Its Own Cellular Modem, Chip Chief Says",,https://www.bloomberg.com/news/articles/2020-12-10/apple-starts-work-on-its-own-cellular-modem-chip-chief-says,,2020-12-10T23:57:50Z,
17,"{'id': 'bloomberg', 'name': 'Bloomberg'}",,Apple Is at the Cutting Edge of a Revolution in Chips (Podcast),,https://www.bloomberg.com/news/audio/2020-12-16/apple-is-at-the-cutting-edge-of-a-revolution-in-chips-podcast,,2020-12-16T21:40:43Z,
18,"{'id': 'bloomberg', 'name': 'Bloomberg'}",,Apple Preps Next Mac Chips With Aim to Outclass Highest-End PCs,,https://www.bloomberg.com/news/articles/2020-12-07/apple-preps-next-mac-chips-with-aim-to-outclass-highest-end-pcs,,2020-12-07T11:00:00Z,
19,"{'id': 'bloomberg', 'name': 'Bloomberg'}",,Apple to Suspend New Orders to Wistron After India Workers Riot,,https://www.bloomberg.com/news/articles/2020-12-19/apple-to-suspend-new-orders-to-wistron-after-india-workers-riot,,2020-12-19T13:23:58Z,
20,"{'id': 'bloomberg', 'name': 'Bloomberg'}",,Los Angeles Vaccine Recipients Can Put the Proof in Apple Wallet,,https://www.bloomberg.com/news/articles/2020-12-28/los-angeles-vaccine-recipients-can-put-the-proof-in-apple-wallet,,2020-12-28T13:00:00Z,
21,"{'id': 'bloomberg', 'name': 'Bloomberg'}",,Apple Preps Next Mac Chips With Aim to Outclass Top-End PCs,,https://www.bloomberg.com/news/videos/2020-12-07/apple-preps-next-mac-chips-with-aim-to-outclass-top-end-pcs-video,,2020-12-07T23:15:41Z,
22,"{'id': 'bloomberg', 'name': 'Bloomberg'}",,Apple Is at the Cutting Edge of a Revolution in Chips,,https://www.bloomberg.com/news/articles/2020-12-17/apple-is-at-the-cutting-edge-of-a-revolution-in-chips,,2020-12-17T09:00:22Z,
23,"{'id': 'bloomberg', 'name': 'Bloomberg'}",,Apple Is at the Cutting Edge of a Revolution in Chips (Podcast),,https://www.bloomberg.com/news/audio/2020-12-17/apple-is-at-the-cutting-edge-of-a-revolution-in-chips-podcast,,2020-12-17T15:04:08Z,
24,"{'id': 'bloomberg', 'name': 'Bloomberg'}",,Consumers Will Be Hurt If Apple Makes Software Ad Changes: Stu Ingis,,https://www.bloomberg.com/news/videos/2020-12-21/consumers-will-be-hurt-if-apple-makes-software-ad-changes-stu-ingis-video,,2020-12-21T22:58:37Z,
25,"{'id': 'bloomberg', 'name': 'Bloomberg'}",,Your Evening Briefing: Musk Says He Wanted to Sell Tesla to Apple,,https://www.bloomberg.com/news/newsletters/2020-12-22/your-evening-briefing-musk-says-he-wanted-to-sell-tesla-to-apple,,2020-12-22T22:38:33Z,
26,"{'id': 'bloomberg', 'name': 'Bloomberg'}",,"Apple Starts Work on Its Own Cellular Modem, Chip Chief Says - Bloomberg","<ol><li>Apple Starts Work on Its Own Cellular Modem, Chip Chief Says  Bloomberg
</li><li>Bloomberg: Apple started developing its first cellular modem chip for future devices  9to5Mac
</li><li>Apple Developing In-House Modem That Will Eventually Replace Qual…",https://www.bloomberg.com/tosv2.html?vid=&uuid=b2405db0-3b4f-11eb-9af1-17ba76936d8a&url=L25ld3MvYXJ0aWNsZXMvMjAyMC0xMi0xMC9hcHBsZS1zdGFydHMtd29yay1vbi1pdHMtb3duLWNlbGx1bGFyLW1vZGVtLWNoaXAtY2hpZWYtc2F5cw==,,2020-12-10T23:00:00Z,
27,"{'id': 'bloomberg', 'name': 'Bloomberg'}",,iPhone Maker Slides After Riot Spurs Apple to Suspend Business - Bloomberg,iPhone Maker Slides After Riot Spurs Apple to Suspend Business  Bloomberg,https://www.bloomberg.com/news/articles/2020-12-21/iphone-maker-slides-after-riot-spurs-apple-to-suspend-business,,2020-12-21T02:53:00Z,
28,"{'id': 'bloomberg', 'name': 'Bloomberg'}",,Apple Shifts Leadership of Self-Driving Car Unit to AI Chief - Bloomberg,"<ol><li>Apple Shifts Leadership of Self-Driving Car Unit to AI Chief  Bloomberg
</li><li>Apple reportedly hands over its self-driving car project to executive who oversees Siri  The Verge
</li><li>Bloomberg: Apple self-driving car leadership shifts to AI bo…",https://www.bloomberg.com/tosv2.html?vid=&uuid=1e8db260-39a2-11eb-b429-5917a2feb2f1&url=L25ld3MvYXJ0aWNsZXMvMjAyMC0xMi0wOC9hcHBsZS1zaGlmdHMtbGVhZGVyc2hpcC1vZi1zZWxmLWRyaXZpbmctY2FyLWRpdmlzaW9uLXRvLWFpLWNoaWVm,,2020-12-08T19:30:00Z,
29,"{'id': 'bloomberg', 'name': 'Bloomberg'}",,Apple Preps Next Mac Chips With Aim to Outclass Highest-End PCs - Bloomberg,"<ol><li>Apple Preps Next Mac Chips With Aim to Outclass Highest-End PCs  Bloomberg
</li><li>Microsoft Surface Book could beat Apple MacBooks to the 5G punch  TechRadar
</li><li>Apple may be bringing a revolutionary matte black finish to future iPhones and M…",https://www.bloomberg.com/tosv2.html?vid=&uuid=52f2a200-3889-11eb-8518-a9b2c5e6e728&url=L25ld3MvYXJ0aWNsZXMvMjAyMC0xMi0wNy9hcHBsZS1wcmVwcy1uZXh0LW1hYy1jaGlwcy13aXRoLWFpbS10by1vdXRjbGFzcy1oaWdoZXN0LWVuZC1wY3M=,,2020-12-07T11:00:00Z,
30,"{'id': 'bloomberg', 'name': 'Bloomberg'}",,Apple Leads Big Tech Stocks Higher and Nears Intraday Record - Bloomberg,Apple Leads Big Tech Stocks Higher and Nears Intraday Record  Bloomberg,https://www.bloomberg.com/news/articles/2020-12-28/apple-leads-big-tech-stocks-higher-and-nears-intraday-record,,2020-12-28T16:45:00Z,
31,"{'id': 'bloomberg', 'name': 'Bloomberg'}",,Apple Hires Prominent Venture Capitalist for App Store Role - Bloomberg,"<ol><li>Apple Hires Prominent Venture Capitalist for App Store Role  Bloomberg
</li><li>Apple hires venture capitalist Josh Elman to help improve App Store discovery  The Verge
</li><li>With an eye for what’s next, longtime operator and VC Josh Elman gets p…",https://www.bloomberg.com/tosv2.html?vid=&uuid=db681130-339b-11eb-99f3-e52afeec8eaf&url=L25ld3MvYXJ0aWNsZXMvMjAyMC0xMS0zMC9hcHBsZS1oaXJlcy1wcm9taW5lbnQtdmVudHVyZS1jYXBpdGFsaXN0LWZvci1hcHAtc3RvcmUtcm9sZQ==,,2020-11-30T19:00:00Z,
32,"{'id': 'bloomberg', 'name': 'Bloomberg'}",,Los Angeles Vaccine Recipients Can Put the Proof in Apple Wallet - Bloomberg,"<ol><li>Los Angeles Vaccine Recipients Can Put the Proof in Apple Wallet  Bloomberg
</li><li>Dr. Tedros: The WHO Won't Rest Until All Countries Have the Covid-19 Vaccine  Bloomberg Quicktake: Now
</li><li>Number of vaccines administered in Wisconsin  tmj4.c…",https://www.bloomberg.com/tosv2.html?vid=&uuid=e24107f0-49d0-11eb-88e8-bbd0d188de84&url=L25ld3MvYXJ0aWNsZXMvMjAyMC0xMi0yOC9sb3MtYW5nZWxlcy12YWNjaW5lLXJlY2lwaWVudHMtY2FuLXB1dC10aGUtcHJvb2YtaW4tYXBwbGUtd2FsbGV0,,2020-12-28T13:00:00Z,
33,"{'id': 'bloomberg', 'name': 'Bloomberg'}",,Riot-Hit Apple Supplier Hired More Than It Could Handle in India - Bloomberg,"<ol><li>Riot-Hit Apple Supplier Hired More Than It Could Handle in India  Bloomberg
</li><li>Apple Supplier Wistron's 'Labour Violations': 12-Hour Shifts, No Overtime  Gadgets 360
</li><li>Wistron India Violence: Initial Investigation Shows 'Labour Violatio…",https://www.bloomberg.com/tosv2.html?vid=&uuid=164ebec0-4184-11eb-b4f7-e748434bafaf&url=L25ld3MvYXJ0aWNsZXMvMjAyMC0xMi0xOC9yaW90LWJyb2tlLWFzLWluZGlhLWlwaG9uZS1tYWtlci1oaXJlZC1tb3JlLXRoYW4taXQtY291bGQtaGFuZGxl,,2020-12-18T11:07:00Z,
34,"{'id': 'bloomberg', 'name': 'Bloomberg'}",Bloomberg,Oracle Lured to Texas by Lower Payrolls and Labor Pool,"Oracle has a campus in Austin, opened in 2018 to local fanfare, which it said could eventually house as many as 10,000 workers.",https://www.bloomberg.com/news/articles/2020-12-21/oracle-lured-to-texas-by-lower-payrolls-and-labor-pool,https://www.bloomberg.com/sites/all/themes/penton_subtheme_nreionline/images/logos/share-logo.png,2020-12-21T13:09:00Z,(Bloomberg) -- Oracle Corp.s surprise decision to shift its headquarters to Texas from California marks a strategic realignment for the Silicon Valley stalwart thats likely to yield long-term financi… [+6141 chars]
35,"{'id': 'bloomberg', 'name': 'Bloomberg'}",,Apple Launches $550 Over-Ear Headphones Into Crowded Market - Bloomberg,Apple Launches $550 Over-Ear Headphones Into Crowded Market  Bloomberg,https://www.bloomberg.com/news/articles/2020-12-08/apple-launches-airpods-max-headphones-into-crowded-market,,2020-12-08T13:57:00Z,
36,"{'id': 'bloomberg', 'name': 'Bloomberg'}",,Tesla Stock Price on Collision Course With Apple Car - Bloomberg,Tesla Stock Price on Collision Course With Apple Car  Bloomberg,https://www.bloomberg.com/opinion/articles/2020-12-22/tesla-stock-price-on-collision-course-with-apple-car,,2020-12-22T21:42:00Z,
37,"{'id': 'bloomberg', 'name': 'Bloomberg'}",,"Apple, Amazon, Google Could Face EU Fines as High as 10% Annual Revenue - Bloomberg","Apple, Amazon, Google Could Face EU Fines as High as 10% Annual Revenue  Bloomberg",https://www.bloomberg.com/news/articles/2020-12-14/tech-giants-could-face-fines-as-high-as-10-annual-revenue,,2020-12-14T13:26:00Z,
38,"{'id': 'bloomberg', 'name': 'Bloomberg'}",,Apple Shifts Leadership of Self-Driving Car Division to AI Chief - Bloomberg,Apple Shifts Leadership of Self-Driving Car Division to AI Chief  Bloomberg,https://www.bloomberg.com/news/articles/2020-12-08/apple-shifts-leadership-of-self-driving-car-division-to-ai-chief,,2020-12-08T19:30:00Z,
39,"{'id': 'bloomberg', 'name': 'Bloomberg'}",,"Apple Music Now Available on Google Speakers, Expanding Market - Gooruf UK News","Apple Inc. ’ s streaming music service is now available on smart speakers from Google and others running its voice-based Google Assistant, opening a large new market. Subscribers to Apple Music will now be able to play songs on Google’s speaker hardware, incl…",https://www.bloomberg.com/news/articles/2020-12-07/apple-music-now-available-on-google-speakers-expanding-market,https://gooruf.com/wpraw/uk/news/wp-content/uploads/2020/10/post_default_20200114.jpg,2020-12-07T20:00:33Z,"Article summary
Apple Inc. s streaming music service is now available on smart speakers from Google and others running its voice-based Google Assistant, opening a large new market. Subscribers to Ap… [+676 chars]"
40,"{'id': 'bloomberg', 'name': 'Bloomberg'}",Tim Culpan,Apple-Tesla Showdown Over Self-Driving Cars Will Happen on Factory Floor,Apple-Tesla Showdown Over Self-Driving Cars Will Happen on Factory Floorbloomberg.com,https://www.bloomberg.com/opinion/articles/2020-12-22/apple-tesla-showdown-over-self-driving-cars-will-happen-on-factory-floor,,2020-12-22T11:29:28Z,
41,"{'id': 'bloomberg', 'name': 'Bloomberg'}",Mark Gurman,Apple to Temporarily Close LA Stores as Virus Cases Jump,Apple to Temporarily Close LA Stores as Virus Cases Jumpbloomberg.com,https://www.bloomberg.com/news/articles/2020-12-18/apple-to-temporarily-close-la-stores-as-virus-cases-jump,,2020-12-18T22:08:53Z,
