,source,author,title,description,url,urlToImage,publishedAt,content
0,"{'id': 'business-insider', 'name': 'Business Insider'}",Antonio Villas-Boas and Kevin Webb,The best Cyber Monday Apple Watch deals still available include $50 off the Series 6 and $20 off the SE,"Summary List Placement<ul>
<li>
Cyber Monday 2020 Apple deals are still live, bringing some of the best prices of the year for highly coveted tech products like Apple Watches and AirPods.</li>
<li>The $400 Apple Watch Series 6, released in September 2020, is …",https://www.businessinsider.com/cyber-monday-apple-watch-deals-series-6-2020-11,https://i.insider.com/5fbbd88732f2170011f709ea?width=1200&format=jpeg,2020-12-01T04:17:11Z,"When you buy through our links, we may earn money from our affiliate partners. Learn more.
The Apple Watch is the top smartwatch for iPhone users, combining heath and fitness tracking features with … [+2745 chars]"
1,"{'id': 'business-insider', 'name': 'Business Insider'}",Rhea Patel,UnitedHealthcare is offering Motion enrollees a six-month Apple Fitness+ subscription and a free Apple Watch,"Summary List PlacementUnitedHealthcare is enhancing its well-being program Motion by offering
 enrollees a six-month Apple Fitness+ subscription and an Apple Watch free of charge.

After six months, members enrolled in the program can apply program incentive…",https://www.businessinsider.com/unitedhealthcare-giving-motion-enrollees-free-apple-watch-and-fitness-2020-12,https://i.insider.com/5fda2a761803a80018adfc3d?width=1200&format=jpeg,2020-12-16T15:42:54Z,"UnitedHealthcare is enhancing its well-being program Motion by offering
 enrollees a six-month Apple Fitness+ subscription and an Apple Watch free of charge.
Insurers are jumping on the fast-moving… [+3078 chars]"
2,"{'id': 'business-insider', 'name': 'Business Insider'}",Matthew DeBord,The Apple Car news is completely irrelevant to Tesla because Apple most likely wants to sell off Project Titan (TSLA),"Summary List PlacementIn the annals of the electric-car and self-driving-vehicle era, which kicked off in earnest about two decades ago, Tesla has been the dominant story. Apple has been a footnote.
Consider the contrast: Apple has become one of the most valu…",https://www.businessinsider.com/apple-car-irrelevant-to-tesla-apple-wants-sell-project-titan-2020-12,https://i.insider.com/5fe4d819edf8920018093b41?width=1200&format=jpeg,2020-12-25T14:48:00Z,"In the annals of the electric-car and self-driving-vehicle era, which kicked off in earnest about two decades ago, Tesla has been the dominant story. Apple has been a footnote.
Consider the contrast… [+8070 chars]"
3,"{'id': 'business-insider', 'name': 'Business Insider'}",Mary Meisenzahl,"Apple says these were the best apps of 2020, including Zoom, 'Legends of Runeterra,' and 'Pokemon Go' (AAPL)","Summary List PlacementApple released its annual end-of-year roundup, highlighting some of the best apps of 2020. Noting the unique challenges of this year, with a pandemic forcing people to stay home and connect virtually more than ever, Apple chose apps that…",https://www.businessinsider.com/apple-best-apps-of-2020-zoom-pokemon-go-riot-games-2020-12,https://i.insider.com/5fc7c846037cbd0018613568?width=1200&format=jpeg,2020-12-02T17:01:03Z,"Apple released its annual end-of-year roundup, highlighting some of the best apps of 2020. Noting the unique challenges of this year, with a pandemic forcing people to stay home and connect virtually… [+687 chars]"
4,"{'id': 'business-insider', 'name': 'Business Insider'}",Ben Winck,Apple rises 3% after report says the company aims to produce electric cars by 2024,"Summary List Placement<ul>
<li>Apple climbed as much as 3% on Tuesday following a Reuters report on Monday afternoon that the tech giant aims to produce electric cars by 2024.</li>
<li>The company will aim to compete in the electric vehicle market with batter…",https://www.businessinsider.com/apple-stock-price-electric-car-production-battery-technology-report-aapl-2020-12,https://i.insider.com/5faf06391c741f0019ac9d07?width=1200&format=jpeg,2020-12-22T13:52:19Z,<ul><li>Apple climbed as much as 3% on Tuesday following a Reuters report on Monday afternoon that the tech giant aims to produce electric cars by 2024.</li><li>The company will aim to compete in the… [+3417 chars]
5,"{'id': 'business-insider', 'name': 'Business Insider'}",Adriana Nunez,Apple Pay's control of NFC technology is being revisited by global antitrust regulators,"Summary List PlacementApple is facing scrutiny from regulators in Australia and the Netherlands over its control of the near-field communication (NFC) technology used in its mobile wallet offering.

<ul>
<li>Reserve Bank of Australia governor Philip Lowe rais…",https://www.businessinsider.com/apple-control-of-wallet-tech-faces-more-regulatory-scrutiny-2020-12,https://i.insider.com/5f45112889aff80028ab7b48?width=1200&format=jpeg,2020-12-08T13:35:00Z,"Apple is facing scrutiny from regulators in Australia and the Netherlands over its control of the near-field communication (NFC) technology used in its mobile wallet offering.
Global antitrust regul… [+3439 chars]"
6,"{'id': 'business-insider', 'name': 'Business Insider'}",Isobel Asher Hamilton,Apple is offering free fixes for some iPhone 11s with faulty touch screens,"Summary List PlacementApple is offering a free fix on a batch of iPhone 11 models that have a habit of developing faulty, unresponsive touch screens.
The company announced its new free repair program on Friday, which applies to a batch of the phones which wer…",https://www.businessinsider.com/apple-fix-iphone-11s-with-faulty-touch-screens-for-free-2020-12,https://i.insider.com/5f779553282c500018c78684?width=1200&format=jpeg,2020-12-05T10:24:08Z,"Apple is offering a free fix on a batch of iPhone 11 models that have a habit of developing faulty, unresponsive touch screens.
The company announced its new free repair program on Friday, which app… [+925 chars]"
7,"{'id': 'business-insider', 'name': 'Business Insider'}",Isobel Asher Hamilton,Apple released new App Store privacy labels that tell you exactly how you're being tracked when you use your iPhone,"Summary List PlacementApple rolled out an update to its iOS 14 software on Monday that will let users see, in detail, how iPhone apps are tracking them.
The new feature adds labels to every iOS app in the App Store, telling users about how that app collects t…",https://www.businessinsider.com/apple-releases-privacy-labels-ad-trackers-2020-12,https://i.insider.com/5fd8886d2069f400194c7c33?width=1200&format=jpeg,2020-12-15T11:06:40Z,"Apple rolled out an update to its iOS 14 software on Monday that will let users see, in detail, how iPhone apps are tracking them.
The new feature adds labels to every iOS app in the App Store, tell… [+1717 chars]"
8,"{'id': 'business-insider', 'name': 'Business Insider'}",Erum Ahmed,A look back at Apple's most significant healthcare plays in 2020,"Summary List PlacementApple is no stranger to healthcare, and its moves in 2020 highlighted how central its Watch is to its healthcare strategy. In this first installment of our Big Tech Countdown, we look back on Apple's top five healthcare moves from the ye…",https://www.businessinsider.com/apples-top-5-healthcare-moves-in-2020-2020-12,https://i.insider.com/5f74a6c20ab50d00184ad473?width=1200&format=jpeg,2020-12-23T16:05:00Z,"Apple is no stranger to healthcare, and its moves in 2020 highlighted how central its Watch is to its healthcare strategy. In this first installment of our Big Tech Countdown, we look back on Apple's… [+3933 chars]"
9,"{'id': 'business-insider', 'name': 'Business Insider'}",Kevin Shalvey,"Apple CEO Tim Cook says most staff will work from home until June 2021, in line with other tech companies like Google and Facebook","Summary List PlacementApple CEO Tim Cook reportedly told most of his employees not to expect to return to the office until next summer, placing the company in line with similar schedules from Facebook, Google, and others. 
On Thursday, Cook told staff during …",https://www.businessinsider.com/apple-ceo-tim-cook-said-staff-can-wfh-june-2021-2020-12,https://i.insider.com/5fd3325ae00bce00188bab47?width=1200&format=jpeg,2020-12-11T10:30:51Z,"Apple CEO Tim Cook reportedly told most of his employees not to expect to return to the office until next summer, placing the company in line with similar schedules from Facebook, Google, and others.… [+2106 chars]"
10,"{'id': 'business-insider', 'name': 'Business Insider'}",Jason Aten,Apple's M1 is just the beginning. What comes next for the Mac will likely change the way we think about computers forever.,"Summary List PlacementApple's M1-powered Macs have made quite an impression. The first installment in Apple's promise to transition its entire lineup to its own silicon has earned rave reviews from journalists and users.
In many ways, they answered every expe…",https://www.businessinsider.com/what-comes-after-apple-m1-mac-change-way-think-computers-2020-12,https://i.insider.com/5fd0f987240ebd00126bded9?width=1200&format=jpeg,2020-12-09T17:58:36Z,"Apple's M1-powered Macs have made quite an impression. The first installment in Apple's promise to transition its entire lineup to its own silicon has earned rave reviews from journalists and users.… [+6468 chars]"
11,"{'id': 'business-insider', 'name': 'Business Insider'}",Charles Davis,Apple farm hit with $2 million fine after migrant workers die of COVID-19,"Summary List PlacementGebbers Farms boasts that it has some of the world's freshest apples. But, according to the state of Washington, it also has some of the most willfully negligent leadership: Two of its workers dying of COVID-19 while the company defied h…",https://www.businessinsider.com/apple-farm-hit-2-million-fine-workers-die-covid-19-2020-12,https://i.insider.com/5fe13be5d366e60018099850?width=1200&format=jpeg,2020-12-22T01:46:32Z,"Gebbers Farms boasts that it has some of the world's freshest apples. But, according to the state of Washington, it also has some of the most willfully negligent leadership: Two of its workers dying … [+3815 chars]"
12,"{'id': 'business-insider', 'name': 'Business Insider'}",Katie Canales,You'll need a $35 cable in order to use Apple's new $550 AirPods Max with your non-Bluetooth devices (AAPL),"Summary List PlacementApple debuted its heavily anticipated $549 over-ear AirPods Max headphones on Tuesday.
The company's first over-ear headphones are outfitted with a slew of features and come equipped with Bluetooth to sync with Bluetooth-compatible devic…",https://www.businessinsider.com/how-to-use-apple-airpods-max-without-bluetooth-cable-2020-12,https://i.insider.com/5fd0f17f240ebd00126bdea0?width=1200&format=jpeg,2020-12-09T16:34:41Z,"Apple debuted its heavily anticipated $549 over-ear AirPods Max headphones on Tuesday.
The company's first over-ear headphones are outfitted with a slew of features and come equipped with Bluetooth … [+1909 chars]"
13,"{'id': 'business-insider', 'name': 'Business Insider'}",Shona Ghosh,10 things in tech you need to know today,"Summary List PlacementGood morning! This is the tech news you need to know this Tuesday. Sign up here to get this email in your inbox every morning.
Have an Amazon Alexa device? Listen to this update by searching ""Business Insider"" in your flash briefing sett…",https://www.businessinsider.com/10-things-in-tech-you-need-to-know-today-december-22-2020-12,https://i.insider.com/5f87430d2a400c0019debb09?width=1200&format=jpeg,2020-12-22T08:02:53Z,"Good morning! This is the tech news you need to know this Tuesday. Sign up here to get this email in your inbox every morning.
Have an Amazon Alexa device? Listen to this update by searching ""Busine… [+2228 chars]"
14,"{'id': 'business-insider', 'name': 'Business Insider'}",Katie Canales,"Jack Dorsey's Square has reportedly expressed interest in buying Jay-Z's music streaming platform, Tidal (SQ)","Summary List PlacementDigital payments processor Square has discussed buying Tidal, Jay-Z's music streaming platform, sources told Bloomberg.
As the outlet notes, the talks may not necessarily lead to an acquisition, but the reported discussion could be part …",https://www.businessinsider.com/square-could-buy-jay-z-tidal-streaming-service-2020-12,https://i.insider.com/5fe4b45ba6448800181934bc?width=1200&format=jpeg,2020-12-24T15:54:30Z,"Digital payments processor Square has discussed buying Tidal, Jay-Z's music streaming platform, sources told Bloomberg.
As the outlet notes, the talks may not necessarily lead to an acquisition, but… [+1735 chars]"
15,"{'id': 'business-insider', 'name': 'Business Insider'}","Julia Pugachevsky, Antonio Villas-Boas, Steven Cohen and Lisa Eadicicco","Best Buy's Cyber Monday 2020 deals are available now — save big on tablets, 4K TVs, headphones, Apple Watches, and more","Summary List PlacementTable of Contents: Masthead StickyCyber Monday 2020 has finally arrived, which means steep discounts on tech products, smart home gadgets, and more from retail giants like Best Buy.
Best Buy is offering many worthwhile Cyber Monday deals…",https://www.businessinsider.com/best-buy-cyber-monday-2020-deals-tablets-tvs-headphones-laptops-2020-11,https://i.insider.com/5fa47392f7d1cb0019e3a18f?width=1200&format=jpeg,2020-11-30T17:12:39Z,"When you buy through our links, we may earn money from our affiliate partners. Learn more.
Cyber Monday 2020 has finally arrived, which means steep discounts on tech products, smart home gadgets, an… [+1597 chars]"
16,"{'id': 'business-insider', 'name': 'Business Insider'}",Tercius Bufete,"Today's best online deals: Apple Pencil, eufy RoboVac 15C MAX robot vacuum, and Samsung Galaxy Tab S6","Summary List PlacementEvery day, we round up the 5 best deals and bargains available on tech, home goods, fashion, and more. 
We've sorted this list with the best deals first. The prices and discounts are accurate at the time of publication but are subject to…",https://www.businessinsider.com/best-online-deals-today-wednesday-december-16-2020,https://i.insider.com/5fda14421803a80018adfbab?width=1200&format=jpeg,2020-12-16T14:56:03Z,"When you buy through our links, we may earn money from our affiliate partners. Learn more.
Every day, we round up the 5 best deals and bargains available on tech, home goods, fashion, and more. 
We… [+288 chars]"
17,"{'id': 'business-insider', 'name': 'Business Insider'}",Sara M. Watson,Apple and Cloudflare's Oblivious DNS addresses a gap in the privacy protections of the internet's routing infrastructure,"Summary List PlacementEngineers at Apple, Cloudflare, and Fastly have collaborated on a new protocol that would mask internet traffic and improve fundamental privacy protections for internet users, according to
 TechCrunch.

The new protocol changes how the …",https://www.businessinsider.com/apple-cloudflare-introduce-new-privacy-protecting-protocol-2020-12,https://i.insider.com/5f5907607ed0ee001e25e40f?width=1200&format=jpeg,2020-12-10T15:41:07Z,"Engineers at Apple, Cloudflare, and Fastly have collaborated on a new protocol that would mask internet traffic and improve fundamental privacy protections for internet users, according to
 TechCrun… [+2872 chars]"
18,"{'id': 'business-insider', 'name': 'Business Insider'}",Lisa Eadicicco and Malarie Gokey,Cyber Monday AirPods deals are available now — save more than $50 on the Apple AirPods and AirPods Pro,"Summary List Placement

Apple's AirPods are some of the most popular wireless earbuds in the world, and they're on sale for Cyber Monday 2020. Whether you're interested in Apple's standard AirPods or the noise-cancelling AirPods Pro, deals are available on al…",https://www.businessinsider.com/cyber-monday-apple-airpods-deals-wireless-charging-case-2020-11,https://i.insider.com/5fc3fa4150e71a0011557db7?width=1200&format=jpeg,2020-11-30T12:14:07Z,"When you buy through our links, we may earn money from our affiliate partners. Learn more.
Apple's AirPods are some of the most popular wireless earbuds in the world, and they're on sale for Cyber M… [+1494 chars]"
19,"{'id': 'business-insider', 'name': 'Business Insider'}",Avery Hartmans,Apple CEO Tim Cook says he had to take a 'meat axe' to his notifications to reduce his screen time (AAPL),"Summary List PlacementTim Cook said he had to cut down on his iPhone notifications after realizing how much screen time he was clocking every day. 
The Apple CEO discussed screen time during an interview with Michael Roberts on the ""Outside Podcast"" this week…",https://www.businessinsider.com/tim-cook-apple-iphone-screen-time-cut-notifications-2020-12,https://i.insider.com/5fd3d9e1e00bce00188baf18?width=1200&format=jpeg,2020-12-13T12:10:00Z,"Tim Cook said he had to cut down on his iPhone notifications after realizing how much screen time he was clocking every day. 
The Apple CEO discussed screen time during an interview with Michael Rob… [+1722 chars]"
20,"{'id': 'business-insider', 'name': 'Business Insider'}",Lara O'Reilly,Read the pitch deck this tech startup used to raise $17 million to help marketers and publishers comply with privacy laws,"Summary List PlacementNew privacy regulations are springing up around the globe at a rapid pace on the heels of Europe's General Data Protection Regulation and California's Consumer Privacy Act taking effect the past few years. 
Publishers and marketers are t…",https://www.businessinsider.com/pitch-deck-privacy-compliance-platform-sourcepoint-raises-17-million-2020-12,https://i.insider.com/5fd7537de00bce00188bb197?width=1200&format=jpeg,2020-12-15T12:00:00Z,New privacy regulations are springing up around the globe at a rapid pace on the heels of Europe's General Data Protection Regulation and California's Consumer Privacy Act taking effect the past few … [+2091 chars]
21,"{'id': 'business-insider', 'name': 'Business Insider'}",Ramsay Lewis,"What is a large-cap stock? It represents a $10 billion-plus company — and often low-risk, stable returns for investors","Summary List PlacementIn August 2020 Apple (AAPL) became the first US exchange-listed company to reach a market capitalization of $2 trillion. That record comes just two years after it became the first company to break the $1 trillion mark.
Not bad for an out…",https://www.businessinsider.com/what-is-a-large-cap-stock,https://i.insider.com/5fcc3f9e037cbd00186141bc?width=1200&format=jpeg,2020-12-07T14:42:36Z,In August 2020 Apple (AAPL) became the first US exchange-listed company to reach a market capitalization of $2 trillion. That record comes just two years after it became the first company to break th… [+6575 chars]
22,"{'id': 'business-insider', 'name': 'Business Insider'}",Martin Coulter,Europe is about to hobble the power of tech giants like Facebook and Amazon. Here's what we know about its huge new proposals.,"Summary List PlacementThe EU is set to unveil a raft of new policy proposals designed to curb the influence of the likes of Amazon, Apple, and Facebook this week, following a decade of scandals, antitrust investigations, and mounting scrutiny on the continent…",https://www.businessinsider.com/eu-rules-big-tech-dsa-dma-facebook-google-apple-2020-12,https://i.insider.com/5fd6ac0ce00bce00188bb143?width=1200&format=jpeg,2020-12-14T13:04:42Z,"The EU is set to unveil a raft of new policy proposals designed to curb the influence of the likes of Amazon, Apple, and Facebook this week, following a decade of scandals, antitrust investigations, … [+6119 chars]"
23,"{'id': 'business-insider', 'name': 'Business Insider'}",Ashley Rodriguez,"Seeking nominations for the top free agent execs in TV, film, and streaming video","Summary List PlacementBig media's massive restructurings and pandemic-driven business troubles have thrust experienced talent in the TV and film industries onto the job market in 2020.
Across the US media landscape, a staggering 28,637 jobs were slashed this …",https://www.businessinsider.com/seeking-nominations-top-execs-job-market-tv-film-streaming-video-2020-12,https://i.insider.com/5fce76e2037cbd00186144a9?width=1200&format=jpeg,2020-12-07T18:41:33Z,"Big media's massive restructurings and pandemic-driven business troubles have thrust experienced talent in the TV and film industries onto the job market in 2020.
Across the US media landscape, a st… [+1393 chars]"
24,"{'id': 'business-insider', 'name': 'Business Insider'}",Libertina Brandt,Manhattan rents have been slashed more during the pandemic than during the Great Recession — and have even farther to fall,"Summary List PlacementFor once, the rent isn't too darn high.
Since the onset of the coronavirus pandemic, the New York City rental-apartment market has been rocked by falling prices and rising vacancy rates. The jolt follows a mass exodus of Big Apple reside…",https://www.businessinsider.com/new-york-city-rent-decrease-manhattan-market-report-streeteasy-2020-12,https://i.insider.com/5fd923a41803a80018adf9c1?width=1200&format=jpeg,2020-12-17T12:00:00Z,"For once, the rent isn't too darn high.
Since the onset of the coronavirus pandemic, the New York City rental-apartment market has been rocked by falling prices and rising vacancy rates. The jolt fo… [+4585 chars]"
25,"{'id': 'business-insider', 'name': 'Business Insider'}",Erum Ahmed,Amazon's Halo can now be purchased by anyone—but it's late to the game,"Summary List PlacementTech behemoth Amazon's Halo fitness wearable is now available
 to anyone to purchase for $99.99.

The Halo band and accompanying app—which measures health factors like body fat percentage, activity, sleep, and tone of voice—first launch…",https://www.businessinsider.com/amazon-arrived-to-wearables-game-might-be-too-late-2020-12,https://i.insider.com/5fd8c6cb2069f400194c7cb7?width=1200&format=jpeg,2020-12-15T14:27:54Z,"Tech behemoth Amazon's Halo fitness wearable is now available
 to anyone to purchase for $99.99.
Amazon's Halo release builds on a busy year of healthcare disruption.
Insider Intelligence
The Hal… [+3614 chars]"
26,"{'id': 'business-insider', 'name': 'Business Insider'}",Abby Tang and Michelle Yan Huang,Nutritionists debunk 19 diet myths,"Summary List PlacementFollowing is a transcript of the video. 
Vanessa Risseto: Red wine is good for your heart. Okay, actually, this is the biggest myth of all time.
Tamar Samuels: Meat is a necessary part of a balanced diet. This is a controversial one, and…",https://www.businessinsider.com/nutritionists-debunk-19-myths-about-food-and-your-diet-2020-12,https://i.insider.com/5fe34937a64488001819317e?width=1200&format=jpeg,2020-12-24T18:15:00Z,"Following is a transcript of the video. 
Vanessa Risseto: Red wine is good for your heart. Okay, actually, this is the biggest myth of all time.
Tamar Samuels: Meat is a necessary part of a balance… [+13603 chars]"
27,"{'id': 'business-insider', 'name': 'Business Insider'}",Victor Chatenay,Railsbank announces new products to help nonfinancial firms embed finance,"Summary List PlacementThe UK-based Banking as a Service (BaaS) provider announced two new products
 at this week's Singapore FinTech Festival, per a press release seen by Insider Intelligence.

The new OpenRailz API will allow financial services providers to…",https://www.businessinsider.com/railsbank-launching-two-embedded-finance-products-2020-12,https://i.insider.com/5fcf9f4ceadd8400183dfc08?width=1200&format=jpeg,2020-12-08T15:46:52Z,"The UK-based Banking as a Service (BaaS) provider announced two new products
 at this week's Singapore FinTech Festival, per a press release seen by Insider Intelligence.
Railsbank to launch two em… [+1899 chars]"
28,"{'id': 'business-insider', 'name': 'Business Insider'}",Connie Chen and Sarah Saril,2020's holiday shipping deadlines are coming up fast — December 11 is the cutoff for standard shipping at most stores,"Summary List Placement

<ul>
<li>Choosing the perfect gift for everyone on your list is only half of the struggle; making sure it arrives on time is the real challenge. </li>
<li>December 11 is the deadline for most retailers' standard shipping and December 1…",https://www.businessinsider.com/holiday-shipping-deadlines-gifts-2020-12,https://i.insider.com/5fcfbbbbcee0cf00114fa28f?width=1200&format=jpeg,2020-12-09T20:34:42Z,"When you buy through our links, we may earn money from our affiliate partners. Learn more.
Finding the perfect gift for everyone in your life is rarely an easy process (thankfully, we have tons of g… [+6389 chars]"
29,"{'id': 'business-insider', 'name': 'Business Insider'}",Ashley Rodriguez,A 67-page report from Wall Street analysts predicts the global TV industry's likely winners and losers in the next decade. Here are the 6 key takeaways.,"Summary List PlacementThe global TV industry will be redefined — again — in the next 10 years, UBS analysts predicted in a 67-page report published on December 1.
The report sketched out the evolution of the industry thus far, and said it's approaching a new …",https://www.businessinsider.com/analysts-predict-global-tv-industry-winners-losers-next-decade-2020-12,https://i.insider.com/5fca2a5eb6a3a800199b689d?width=1200&format=jpeg,2020-12-07T14:28:48Z,"The global TV industry will be redefined — again — in the next 10 years, UBS analysts predicted in a 67-page report published on December 1.
The report sketched out the evolution of the industry thu… [+6101 chars]"
