,username,id,date,retweet,likes,text,Symbol,Subjectivity,Polarity,Score
828,Benzinga,1341366484040335366,2020-12-22 12:54:25,1,3,"b""$SPWH Sportsman's Warehouse Holdings shares are trading higher after the company announced it will be acquired by The Great American Outdoors Group for $18 per share in cash. $MIK $ULTA""","['SPWH', '18', 'MIK', 'ULTA']",0.4166666666666667,0.35000000000000003,Positive
829,Benzinga,1341365908007235584,2020-12-22 12:52:08,8,29,b'$FUBO FuboTV shares are trading higher after Needham maintained a Buy rating on the stock and raised its price target from $30 to $60.',"['FUBO', '30', '60']",0.5,0.25,Positive
830,Benzinga,1341365658576183297,2020-12-22 12:51:09,9,21,b'$AAPL Apple shares are trading higher following reports suggesting the company could enter the self-driving vehicle industry. $TSLA $VLDR',"['AAPL', 'TSLA', 'VLDR']",0.3,0.125,Positive
831,Benzinga,1341351438426005505,2020-12-22 11:54:38,5,20,b'$PTON Peloton Interactive shares are trading higher after the company announced it will acquire Precor in a transaction valued at $420 million.',"['PTON', '420']",0.5,0.25,Positive
832,Benzinga,1341338044251553792,2020-12-22 11:01:25,4,8,"b""Why Apple Could Emerge As Tesla's 'First True Competitor' $AAPL $TSLA\n\n""","['AAPL', 'TSLA']",0.4916666666666667,0.3,Positive
834,Benzinga,1341292219907502080,2020-12-22 07:59:19,4,14,"b'Bitcoin Controlled By China, Ripple Tells SEC In Face Of Imminent Lawsuit $BTC $XRP $ETH $GBTC\n\n'","['BTC', 'XRP', 'ETH', 'GBTC']",0.6,-0.1,Negative
836,Benzinga,1341217025285230592,2020-12-22 03:00:32,13,13,b'Pfizer Partner BioNTech Confident Vaccine Effective Against UK Mutant COVID-19 Strain $PFE $BNTX\n\n',"['PFE', 'BNTX']",0.8166666666666667,0.55,Positive
838,Benzinga,1341166039489515520,2020-12-21 23:37:56,34,199,"b""Check out our video with  and . These guys are making some crazy trades that you don't want to miss. $PFE $MRNA $LK $PLTR $IPOC $NKLA $ATLAS ""","['PFE', 'MRNA', 'LK', 'PLTR', 'IPOC', 'NKLA', 'ATLAS']",0.9,-0.6,Negative
840,Benzinga,1341148851164463104,2020-12-21 22:29:38,8,0,b'12 New SPACs Filed Offerings On Friday: What Investors Should Know $BABA $DEO $DIS  via  Se\xe2\x80\xa6',"['BABA', 'DEO', 'DIS']",0.45454545454545453,0.13636363636363635,Positive
843,IBDinvestors,1353743683816984596,2021-01-25 16:37:00,2,13,"b""Millennials love Tesla $TSLA, but they're actually making much more money on their five other top stock picks. stockstowatch """,['TSLA'],0.41500000000000004,0.275,Positive
844,IBDinvestors,1353499197224464385,2021-01-25 00:25:30,6,0,"b""Futures rise modestly as Apple leads earnings tsunami. It's a big week for the market rally. \n$AAPL\xe2\x80\xa6""",['AAPL'],0.5,0.05,Positive
848,IBDinvestors,1352663015519383553,2021-01-22 17:02:48,1,4,"b'Catch the next big breakout stock early with the Blue Dot, a powerful MarketSmith exclusive. 3 weeks for $19.95!  investing stocks profits '",['19'],0.3,0.095,Positive
850,IBDinvestors,1352278025673576451,2021-01-21 15:33:00,1,13,"b""On the latest InvestingwithIBD, Jeff Hirsch of Stock Trader's Almanac () joins  to analyze post-election year market cycles. Plus, we take a look at several stocks including $AVID, $OSIS and $DOX. To watch the full episode, go to  ""","['AVID', 'OSIS', 'DOX']",0.6125,0.275,Positive
852,IBDinvestors,1351998174966083586,2021-01-20 21:00:58,8,26,"b'Techs Lead On Biden Inauguration Day; Apple, Five9 and Datadog Offer Early Entries $AAPL $FIVN $DDOG '","['AAPL', 'FIVN', 'DDOG']",0.3,0.1,Positive
854,IBDinvestors,1351969709256654850,2021-01-20 19:07:51,0,5,"b""Tesla's latest price target hike marks another new high. $TSLA stockmarket """,['TSLA'],0.6315151515151515,0.26545454545454544,Positive
855,IBDinvestors,1351939144973484034,2021-01-20 17:06:24,2,10,"b'Docusign stock is showing just enough volatility for option investors to take advantage of a bull put spread in this stock. Here\xe2\x80\x99s how this trade can offer a high potential return on risk. $DOCU For more about options, go to  '",['DOCU'],0.635,0.165,Positive
856,IBDinvestors,1351681094454829060,2021-01-20 00:01:00,1,0,"b'Futures rise, led by techs as Netflix flashes buy signal on strong subscriber gains (but $DIS does nicely too AH). Tuesday\xe2\x80\xa6'",['DIS'],0.8666666666666667,0.5166666666666666,Positive
859,IBDinvestors,1351655839434747905,2021-01-19 22:20:39,4,12,"b""The solar energy sector has been on fire.  CFO Tom vonReichbauer () discusses the driving forces behind the industry's growth and what's ahead for the company this year. Watch HERE:  $RUN $TAN ""","['RUN', 'TAN']",0.7,-0.4,Negative
860,IBDinvestors,1351635416634429442,2021-01-19 20:59:30,5,16,"b'Stocks rebound, Qualcomm, Maravai, One Medical clear buy points $QCOM $MRVI $ONEM '","['QCOM', 'MRVI', 'ONEM']",0.19166666666666665,0.05000000000000001,Positive
863,IBDinvestors,1351321299663147008,2021-01-19 00:11:18,7,0,b'Futures signal major indexes to hold key levels; Tesla Model Y launches in China.\n $TSLA $NIO $JPM\xe2\x80\xa6',"['TSLA', 'NIO', 'JPM']",0.75,0.03125,Positive
864,IBDinvestors,1350533538731483136,2021-01-16 20:01:01,0,10,"b'Catch the next big breakout stock early with the Blue Dot, a powerful MarketSmith exclusive. 3 weeks for $19.95!  investing stocks profits '",['19'],0.3,0.095,Positive
865,IBDinvestors,1350187582777225216,2021-01-15 21:06:19,5,20,"b'Stock market analysis: Nasdaq pullback healthy; SolarEdge, Yatsen IPO dive, Repligen in buy zone $SEDG $YSG $RGEN '","['SEDG', 'YSG', 'RGEN']",0.5,0.5,Positive
869,IBDinvestors,1350104997757808642,2021-01-15 15:38:09,0,5,"b""A growing number of Americans are willing to get a coronavirus vaccine, and that's proving to be a boon for Pfizer $PFE. """,['PFE'],0.75,0.25,Positive
870,IBDinvestors,1349844598168940544,2021-01-14 22:23:25,1,3,b'Mobileye\xe2\x80\x99s  tells  about the company\xe2\x80\x99s new autonomous vehicle lidar chip technology developed by  and why consumers can expect to see self-driving cars on the road within the next five years. $INTC\nWATCH here:  ',['INTC'],0.36363636363636365,0.1590909090909091,Positive
878,IBDinvestors,1349453700578889730,2021-01-13 20:30:08,3,12,"b'Bitcoin is surging, and not without its fair share of volatility. But the CEO of  says bitcoin\xe2\x80\x99s story now is different than the boom-bust cycle of 2017 &amp; 2018. Plus, we discuss e-sports &amp; video games. WATCH the full segment HERE:  $GBTC $ESPO '","['GBTC', 'ESPO']",0.6833333333333332,0.3499999999999999,Positive
879,IBDinvestors,1349413269665165317,2021-01-13 17:49:29,2,11,"b'Electric car stock $NIO is showing implied volatility of 98%. What does this mean? Higher volatility = higher option premium. Here\xe2\x80\x99s an option trade for investors looking to take advantage of the inflated premiums in  stock. For more, go to  '",['NIO'],0.546875,0.171875,Positive
880,IBDinvestors,1349405776973017088,2021-01-13 17:19:42,2,12,"b'CES2021 is in full swing and  of  breaks down the tech themes taking center stage at this year\xe2\x80\x99s all-digital conference, including 5G and health tech. Full segment here:  $ACN '",['ACN'],0.37222222222222223,0.11111111111111109,Positive
881,IBDinvestors,1349384112339972098,2021-01-13 15:53:37,0,5,b'$AFRM could be the first blockbuster IPO for 2021. stockstowatch ',['AFRM'],0.3333333333333333,0.25,Positive
883,IBDinvestors,1349142312962633733,2021-01-12 23:52:47,2,0,"b'On eve of Trump impeachment vote, the major indexes edge higher as growth stocks heat up, $GM, $UBER lead stocks entering\xe2\x80\xa6'","['GM', 'UBER']",0.5,0.15625,Positive
884,IBDinvestors,1349099116769382400,2021-01-12 21:01:09,8,24,"b'Stock Market shows positive action; gig economy IPOs Uber, DoorDash, Airbnb flash buy signals $UBER $DASH $ABNB '","['UBER', 'DASH', 'ABNB']",0.3227272727272727,0.16363636363636364,Positive
886,IBDinvestors,1349003688812048385,2021-01-12 14:41:57,0,6,"b""Here's what social media users are worth to Twitter $TWTR, Facebook $FB, and other social media stocks. ""","['TWTR', 'FB']",0.15208333333333335,0.06041666666666666,Positive
887,IBDinvestors,1348984862565224460,2021-01-12 13:27:08,5,31,b'Advanced Micro Devices $AMD leads this list of the best stockstowatch in January 2021. ',['AMD'],0.44999999999999996,0.7,Positive
889,IBDinvestors,1348737499229655040,2021-01-11 21:04:12,6,31,"b'Indexes take needed break, but Etsy, Innovative Industrial Properties, GM stage bullish rebounds $ETSY $IIPR $GM '","['ETSY', 'IIPR', 'GM']",1.0,0.5,Positive
892,IBDinvestors,1348691798504349697,2021-01-11 18:02:36,2,12,b'Nio $NIO stock surged Monday after the company unveiled a new electric car over the weekend. evs stockstowatch\n\n',['NIO'],0.45454545454545453,0.13636363636363635,Positive
894,IBDinvestors,1348424185371127809,2021-01-11 00:19:12,10,0,b'Futures fall as warning signs grow. These hot EV stocks are in focus.  $TSLA $NIO $XPEV $LI $BYDDF\xe2\x80\xa6',"['TSLA', 'NIO', 'XPEV', 'LI', 'BYDDF']",0.8500000000000001,0.25,Positive
896,IBDinvestors,1347650386421714944,2021-01-08 21:04:24,7,37,"b'Stocks power past warning signs: Tesla flashes climax top signals; Nio, Chipotle in buy zones $TSLA $NIO $CMG '","['TSLA', 'NIO', 'CMG']",0.375,0.125,Positive
898,IBDinvestors,1347568288608391171,2021-01-08 15:38:11,4,20,b'The race to be the next trillion-dollar company just got more interesting. $TSLA $FB\n\n',"['TSLA', 'FB']",0.3333333333333333,0.3333333333333333,Positive
900,IBDinvestors,1347382420849491969,2021-01-08 03:19:36,14,0,"b'Tesla unveils Model Y SR for $41,990 - $8K cheaper than prior base MY. Range 244 miles. The Ford Mach-E (230mi) and coming\xe2\x80\xa6'","['41', '8K']",0.5,-0.4,Negative
903,IBDinvestors,1347246150064156683,2021-01-07 18:18:07,7,31,"b'Scott St. Clair () kicks off the new year with  on InvestingwithIBD! Hear why post-trade analysis is crucial to finding your investing edge. Plus, we take a look at a few stock ideas. $NTR $CRSR $UBER WATCH here:  '","['NTR', 'CRSR', 'UBER']",0.5181818181818182,-0.009848484848484856,Negative
908,IBDinvestors,1346928677699903491,2021-01-06 21:16:36,3,12,"b'Dow Jones tech giant Salesforce stock is ripe for a big move after forming a new base. With a possible breakout on the horizon, here\xe2\x80\x99s an option trade for investors looking to take advantage of a big move in $CRM. To check out more options videos, go to  '",['CRM'],0.5935064935064934,-0.023376623376623384,Negative
911,IBDinvestors,1346866115922706433,2021-01-06 17:08:00,0,7,"b""GM $GM stock took a spin in the fast lane in the final quarter of 2020. Here's what investors should know about buying this stock. stockstowatch """,['GM'],0.8,0.1,Positive
913,IBDinvestors,1346562236433592327,2021-01-05 21:00:29,1,17,"b'Stocks Rebound:  breaks out, Upstart tries to clear IPO base, Qorvo ascends toward buy point $JD $UPST $QRVO '","['JD', 'UPST', 'QRVO']",0.5944444444444444,-0.26666666666666666,Negative
919,IBDinvestors,1346201156230344704,2021-01-04 21:05:41,7,41,"b'Stock market faces early 2021 test; Nio jumps, Apple falls, Shopify round trips $NIO $AAPL $SHOP '","['NIO', 'AAPL', 'SHOP']",0.35,-0.05,Negative
920,IBDinvestors,1346181798447915008,2021-01-04 19:48:46,1,7,b'Tesla $TSLA stock soared to a new high Monday after the electric vehicle maker notched another delivery record during the fourth quarter. ',['TSLA'],0.3315151515151515,0.0987878787878788,Positive
921,IBDinvestors,1346091661059788800,2021-01-04 13:50:35,2,14,"b'These nine stocks, including Tesla $TSLA, jumped four-times or more than the S&amp;P 500 in January the past five years on average. '",['TSLA'],0.3833333333333333,0.03333333333333333,Positive
922,IBDinvestors,1345052736589586434,2021-01-01 17:02:16,0,5,b'Our New Year deal is here! Get 2 months of IBD Digital + a free gift for $20.21 \xf0\x9f\x8e\x81  ',['20'],0.4181818181818182,0.19015151515151515,Positive
923,IBDinvestors,1344751094962868225,2020-12-31 21:03:39,3,19,"b'Stock Market Analysis: Looking back at 2020, preparing for 2021 \xe2\x80\x93 Jefferies, Pinterest, Hot EV stock in focus $JEF $PINS $BYDDF '","['JEF', 'PINS', 'BYDDF']",0.42500000000000004,0.125,Positive
924,IBDinvestors,1344698674404753408,2020-12-31 17:35:21,8,22,"b""If you'd invested $10,000 in January into these top stocks, you'd have $1.1 million by now. ""","['10', '1']",0.5,0.5,Positive
925,IBDinvestors,1344508710647980033,2020-12-31 05:00:31,1,11,b'Our New Year deal is here! Get 2 months of IBD Digital + a free gift for $20.21 \xf0\x9f\x8e\x81  ',['20'],0.4181818181818182,0.19015151515151515,Positive
926,IBDinvestors,1344328143000244224,2020-12-30 17:03:00,0,10,b'This new IPO stock is growing at an impressive clip and supplies a key component of the Pfizer $PFE and BioNTech $BNTX coronavirus vaccine. stockstowatch ',"['PFE', 'BNTX']",0.8181818181818182,0.37878787878787873,Positive
927,IBDinvestors,1344309033704988673,2020-12-30 15:47:04,0,10,"b""Apple AAPL and Moody's $MCO are two well-known winning stocks that Warren Buffett owns. But many of his top stocks in 2020 are far less obvious. warrenbuffett stockstowatch """,['MCO'],0.5527777777777778,0.2388888888888889,Positive
929,IBDinvestors,1343953423427805184,2020-12-29 16:14:00,9,41,"b""After the company became the world's most valuable automaker this year, here's the 2021 outlook for Tesla $TSLA stock. """,['TSLA'],0.5,0.5,Positive
930,IBDinvestors,1343946557301747714,2020-12-29 15:46:43,1,8,"b""If you lose $609 billion when everyone else is up 14.5% \xe2\x80\x94 that's a bad year. And yet, that's exactly what happened to those betting on some popular stocks in 2020.\n\n""",['609'],0.6055555555555555,0.050000000000000044,Positive
931,IBDinvestors,1343663234444709890,2020-12-28 21:00:53,2,12,"b'Amazon, other big caps lead market rally to new highs, Ross Stores in buy zone; Shopify, growth names retreat $AMZN $ROST $SHOP '","['AMZN', 'ROST', 'SHOP']",0.3098484848484848,0.0037878787878787845,Positive
933,IBDinvestors,1343372220341608448,2020-12-28 01:44:30,6,0,"b'President Trump signs stimulus bill, saying GOP-led Senate will vote on $2,000 direct checks, Section 230 repeal and inves\xe2\x80\xa6'",['2'],0.4,0.1,Positive
935,IBDinvestors,1342189851760844800,2020-12-24 19:26:11,0,16,"b'Stock Market Analysis: Holding at highs, rally looks strong: Generac, Purple Innovation, Taiwan Semi flash buy signals $GRNC $PRPL $TSM Check out the full show here:  '","['GRNC', 'PRPL', 'TSM']",0.6416666666666666,0.3916666666666666,Positive
937,IBDinvestors,1342161050284613634,2020-12-24 17:31:45,4,15,"b'Section230 of the Communications Decency Act now sits in the crosshairs of a Congress that is upset over its broad protections for tech giants like Amazon $AMZN, Facebook $FB, Twitter $TWTR, and others. '","['AMZN', 'FB', 'TWTR']",0.3125,0.0625,Positive
938,IBDinvestors,1342138613421625344,2020-12-24 16:02:35,1,12,"b""Alibaba $BABA looks like it's on sale after selling off sharply in premarket trading Thursday, but does that make this stock a buy right now? \n\n""",['BABA'],0.6428571428571428,0.08035714285714285,Positive
940,IBDinvestors,1341851335205928960,2020-12-23 21:01:03,3,16,"b'Stocks hold near highs: Axon breaks out; AMD, West Pharmaceutical near key levels $AAXN $AMD $WST '","['AAXN', 'AMD', 'WST']",0.6,0.06666666666666667,Positive
941,IBDinvestors,1341830627348377600,2020-12-23 19:38:46,3,27,"b'Leading chipmaker  is ripe for a breakout as the stock has been forming a new base. With a possible breakout on the horizon, here\xe2\x80\x99s an option trade for investors looking to take advantage of a big price swing in $NVDA. For more about options, go to  '",['NVDA'],0.610909090909091,-0.03272727272727274,Negative
943,IBDinvestors,1341503914345115648,2020-12-22 22:00:31,0,8,"b'Make sure to check out the latest episode of \xe2\x80\x9cStock Market Today\xe2\x80\x9d for IBD\xe2\x80\x99s end-of-day market insights and analysis of notable stock moves from today\xe2\x80\x99s trading session. To watch, go to  $ISRG $QRVO $MPWR '","['ISRG', 'QRVO', 'MPWR']",0.762962962962963,0.5,Positive
944,IBDinvestors,1341488780155351040,2020-12-22 21:00:23,4,14,"b'Nasdaq rises in mixed session: Intuitive Surgical breaks out; Qorvo, Monolithic Power near buy points $ISRG $QRVO $MPWR '","['ISRG', 'QRVO', 'MPWR']",0.325,0.05,Positive
945,IBDinvestors,1341477358495096832,2020-12-22 20:15:00,1,8,"b""Here's how investors can use long call options to trade Nio $NIO stock rather than buy it outright. optionstrading stockstowatch\n\n""",['NIO'],0.4,-0.05,Negative
949,IBDinvestors,1341127407890169856,2020-12-21 21:04:25,4,24,"b'The stock market turned in resilient performance Monday, overcoming early fears of a new coronavirus strain in the U.K. $NKE $EXAS $GNRC '","['NKE', 'EXAS', 'GNRC']",0.37727272727272726,0.11818181818181818,Positive
952,IBDinvestors,1340767903277326337,2020-12-20 21:15:53,2,0,b'Target and Chegg among the new names among The 5 Best Stocks To Buy And Watch Now $AMD $CHGG $TGT\n\n\xe2\x80\xa6',"['AMD', 'CHGG', 'TGT']",0.37727272727272726,0.5681818181818181,Positive
954,IBDinvestors,1340346761899102214,2020-12-19 17:22:25,5,0,"b'Idexx Labs, Intuitive Surgical Lead 5 Stocks Clearing At Least Early Buy Points $IDXX $ISRG $EXAS $CRL $TXG \n\xe2\x80\xa6'","['IDXX', 'ISRG', 'EXAS', 'CRL', 'TXG']",0.35,-0.09999999999999999,Negative
955,IBDinvestors,1340040323968290817,2020-12-18 21:04:44,3,21,"b'Stock market analysis: Nasdaq dips as stimulus talks drag, but weekly gains strong; Cadence Design, Chegg in focus $CDNS $CHGG '","['CDNS', 'CHGG']",0.4020833333333333,0.16666666666666663,Positive
956,IBDinvestors,1340035273023840256,2020-12-18 20:44:40,0,11,"b""Tesla $TSLA was in high demand on Friday as funds rushed in to buy shares on the last trading day before the automaker's debut on the S&amp;P 500. stocks stockmarket teslastock\n\n""",['TSLA'],0.3033333333333333,0.08,Positive
957,IBDinvestors,1339977726619508737,2020-12-18 16:56:00,0,8,"b""Despite being first to market, experts say there are a number of reasons why Pfizer $PFE won't be the kingpin of Covid_19 vaccines. """,['PFE'],0.3333333333333333,0.25,Positive
958,IBDinvestors,1339971165834465282,2020-12-18 16:29:56,0,15,b'Bank of America $BAC this week unveiled its top stocks for 2021 it thinks will outperform in all the sectors.\n\n',['BAC'],0.5,0.5,Positive
959,IBDinvestors,1339695207948775424,2020-12-17 22:13:22,2,17,b'Tesla $TSLA stock rose to a record high on Thursday. tesla\n\n',['TSLA'],0.7449999999999999,0.38,Positive
960,IBDinvestors,1339676674594492416,2020-12-17 20:59:43,2,23,"b'The Dow, S&amp;P 500 and Russell 2000 also hit new highs Thursday as more breakouts emerged $LULU $DKNG $EXAS '","['LULU', 'DKNG', 'EXAS']",0.4772727272727273,0.3181818181818182,Positive
961,IBDinvestors,1339666336465760260,2020-12-17 20:18:39,27,100,"b'Find out top growth stocks to watch on the latest episode of InvestingwithIBD!  tells  his top picks for 2021, including $PYPL $ETSY $QCOM and more. WATCH the full episode here:  '","['PYPL', 'ETSY', 'QCOM']",0.5900000000000001,0.495,Positive
962,IBDinvestors,1339662902471454721,2020-12-17 20:05:00,0,10,"b'Is Exact Sciences $EXAS, the IBD Stock Of The Day, on your watchlist? stockstowatch ibdstockoftheday '",['EXAS'],0.25,0.25,Positive
963,IBDinvestors,1339657792991289344,2020-12-17 19:44:42,0,8,"b'General Motors $GM appears well poised to follow the trail Tesla $TSLA has blazed, according to one analyst. stockstowatch stocksinnews \n'","['GM', 'TSLA']",0.5,0.05000000000000002,Positive
964,IBDinvestors,1339601999919136773,2020-12-17 16:03:00,2,22,"b""Tesla $TSLA stock's inclusion in the S&amp;P 500 is finally here. But investors looking for meaningful exposure to this hot stock may look elsewhere.\n\n""",['TSLA'],0.7833333333333333,0.25,Positive
966,IBDinvestors,1339283653055148034,2020-12-16 18:58:00,0,11,b'Grayscale Bitcoin Trust $GBTC and other Bitcoin stocks rallied Wednesday.\n',['GBTC'],0.375,-0.125,Negative
967,IBDinvestors,1339274270124359680,2020-12-16 18:20:43,0,7,"b""Moderna $MRNA stock tumbled Tuesday after Dr. Anthony Fauci reiterated it's unknown how long immunity from CovidVaccines might last.\n\n""",['MRNA'],0.5,-0.07500000000000001,Negative
968,IBDinvestors,1339246996742426625,2020-12-16 16:32:20,6,21,"b'Dow Jones leader  is ripe for another rally after bouncing off the 21-day moving average. With earnings due in January, here\xe2\x80\x99s an option trade for investors looking to get long $AAPL. For more on options, go to  '",['AAPL'],0.41874999999999996,0.04375,Positive
970,IBDinvestors,1338966088344801280,2020-12-15 21:56:06,0,8,b'Make sure to check out the latest episode of \xe2\x80\x9cStock Market Today\xe2\x80\x9d with  and  for IBD\xe2\x80\x99s end-of-day market insights and analysis of notable stock moves from today\xe2\x80\x99s trading session. Watch the full video HERE:  $AAPL $SEDG $CMG ',"['AAPL', 'SEDG', 'CMG']",0.7097222222222221,0.4625,Positive
974,IBDinvestors,1338877225475588099,2020-12-15 16:03:00,3,16,"b'This investment firm named seven semiconductor stocks as ""top picks"" for 2021, including Nvidia $NVDA. '",['NVDA'],0.45,0.15,Positive
975,IBDinvestors,1338631688428154880,2020-12-14 23:47:19,3,0,b'Five stocks flash new buy signals as markets mull coronavirus news; futures rise  $AMD $PYPL $PTON\xe2\x80\xa6',"['AMD', 'PYPL', 'PTON']",0.45454545454545453,0.13636363636363635,Positive
976,IBDinvestors,1338589961205891073,2020-12-14 21:01:31,3,20,b'The Nasdaq composite gapped above its 10-day moving average and is back near highs after last week\xe2\x80\x99s sell-off $IIPR $PTON $PYPL ',"['IIPR', 'PTON', 'PYPL']",0.19333333333333333,-0.009999999999999998,Negative
978,IBDinvestors,1338266222434144256,2020-12-13 23:35:05,3,0,"b'Dow futures rise as coronavirus vaccine shipments begin. Check out $AMD, Shopify and other top stocks near buy points, wit\xe2\x80\xa6'",['AMD'],0.425,0.15833333333333333,Positive
980,IBDinvestors,1337502648849686528,2020-12-11 21:00:55,2,17,b'Will the market rally respect this line? Two stocks in buy zones from tight patterns $TPX $IIPR ',"['TPX', 'IIPR']",0.2857142857142857,-0.17857142857142858,Negative
982,IBDinvestors,1337444884370755586,2020-12-11 17:11:23,1,12,"b""Don't beat yourself up for missing hot IPO stocks like Airbnb $ABNB. It's possible to make money in IPOs in the aftermarket.\n\n""",['ABNB'],0.6333333333333334,0.016666666666666663,Positive
985,IBDinvestors,1337133781694767104,2020-12-10 20:35:10,6,33,"b'On the latest InvestingwithIBD,  is joined by  to discuss how to make a trading strategy your own. Plus, we use 2 key indicators to screen for leading growth stocks like $TSLA, $UBER, $AMZN and $ZM. WATCH the full video at   '","['TSLA', 'UBER', 'AMZN', 'ZM']",0.8625,0.36250000000000004,Positive
987,IBDinvestors,1337075237565812737,2020-12-10 16:42:32,5,15,"b""Is Nio $NIO stock a buy right now? Here's what the analysis and stock charts point to. stockstobuy """,['NIO'],0.5357142857142857,0.2857142857142857,Positive
988,IBDinvestors,1336797135107395592,2020-12-09 22:17:28,2,6,"b'Are Chinese EV companies ,  and  catching up to ? Michael Dunne () explains. To get the full breakdown, watch the segment here:  $TSLA $NIO $LI $XPEV '","['TSLA', 'NIO', 'LI', 'XPEV']",0.4833333333333334,0.31666666666666665,Positive
989,IBDinvestors,1336777962436272128,2020-12-09 21:01:17,4,19,"b'Nasdaq leads sell-off; Shopify, marijuana stock near buy points; Facebook faces antitrust suits $SHOP $IIPR $FB '","['SHOP', 'IIPR', 'FB']",0.4,0.1,Positive
996,IBDinvestors,1336368947382390786,2020-12-08 17:56:00,4,16,b'More good news for Tesla $TSLA:\n\n',['TSLA'],0.55,0.6,Positive
997,IBDinvestors,1336317146092220419,2020-12-08 14:30:09,1,12,"b'NEW InvestingStrategies!  of  talks top tech companies to watch, incl. $AAPL $Z &amp; two upcoming IPOs.  discusses China EV stocks vs. $TSLA, &amp;  shares a WarrenBuffett lesson for growth investors. WATCH:  '","['AAPL', 'Z', 'TSLA']",0.4772727272727273,0.3352272727272727,Positive
999,IBDinvestors,1336054436834119680,2020-12-07 21:06:15,4,13,b'Adobe outperformed with earnings due Wednesday after the close $ADBE  $SWKS $CVNA ',"['ADBE', 'SWKS', 'CVNA']",0.375,-0.125,Negative
1000,IBDinvestors,1335994325650399232,2020-12-07 17:07:23,4,11,"b'Four companies busted past the $1 trillion valuation barrier this year. But now, all eyes are on the fifth stock to do it. '",['1'],0.25,-0.25,Negative
1001,IBDinvestors,1334966096584011776,2020-12-04 21:01:34,2,24,"b'Stock market analysis: Can bulls keep running after another big week? Novocure, Intuitive Surgical strong $NVCR $ISRG '","['NVCR', 'ISRG']",0.41666666666666663,0.21666666666666665,Positive
1005,IBDinvestors,1334664172387307520,2020-12-04 01:01:50,2,21,"b'On this episode of InvestingwithIBD,  of Champion Team Trading talked to  about his risk-first trading strategy. Plus, we look at several stocks showing a rare chart pattern. $NIO, $SNAP and $SRRK To watch the full video, go to  '","['NIO', 'SNAP', 'SRRK']",0.4833333333333334,0.21666666666666665,Positive
1008,IBDinvestors,1334603673079463940,2020-12-03 21:01:26,1,9,"b'Zscaler and Snowflake were big earnings movers, while EXP World Holdings continues to base nicely $ZS $SNOW $EXPI '","['ZS', 'SNOW', 'EXPI']",0.7000000000000001,-0.0666666666666667,Negative
1009,IBDinvestors,1334550776958447622,2020-12-03 17:31:14,1,7,"b""Tesla $TSLA stock is amazing, but investors made more money lately betting on Tesla's archenemy. \n\n""",['TSLA'],0.6666666666666666,0.26666666666666666,Positive
1011,IBDinvestors,1334227442668597254,2020-12-02 20:06:25,6,21,"b'New IPO stock Snowflake reports earnings after the close today. Here\xe2\x80\x99s why this option trade on $SNOW could benefit investors. To watch, go to  '",['SNOW'],0.45454545454545453,0.13636363636363635,Positive
1012,IBDinvestors,1334114341264580611,2020-12-02 12:37:00,1,10,"b""Is Moderna $MRNA stock a good buy? Here's what the stock charts and technical analysis point to: """,['MRNA'],0.35000000000000003,0.35,Positive
